Post_Index,Title,Num_Comments,Upvotes,Downvotes,Upvote_Ratio,Date_Posted,Flair,Post_Category,Top_Comment_Score
1116,Debunking the Myth of Southern Hegemony: Southerners who Stayed Loyal to the US in the Civil War,104,817,0,0.9,2023-12-29 18:43:07,Article,Hot,1.0
1117,Ancient bricks baked when Nebuchadnezzar II was king absorbed a power surge in Earth’s magnetic field,13,1035,0,0.95,2023-12-28 17:30:07,Article,Hot,950.0
1118,Roman Gladiators Were Trained by Ancient Greeks,6,83,0,0.8,2023-12-28 11:48:08,Article,Hot,4.0
1119,‘History is not what happened’: Howell Raines on the Civil War and memory,66,533,0,0.89,2023-12-27 19:37:34,Article,Hot,390.0
1120,Ancient Sahul's (Australia and New Guinea) submerged landscapes reveal a mosaic of human habitation and retreat,2,155,0,0.91,2023-12-27 08:06:42,,Hot,1.0
1121,Bookclub and Sources Wednesday!,23,28,0,0.84,2023-12-27 12:00:29,Discussion/Question,Hot,4.0
1122,The Unlikely Rise and Collapse of the Bulgarian Computer.,12,188,0,0.9,2023-12-25 23:14:45,Video,Hot,19.0
1123,Were Slaves Used To Build The Pyramids? Debunking A Long-Standing Myth,192,809,0,0.79,2023-12-24 20:48:54,Article,Hot,999.0
1124,Korean women in the 19th century who had sons would openly expose their breasts as a sign of pride,8,372,0,0.78,2023-12-25 00:08:46,Article,Hot,1.0
1125,Early Neolithic high mountain settlers were already carrying out complex livestock and farming activities,4,150,0,0.95,2023-12-25 00:08:54,,Hot,3.0
1126,How the Soviet Union collapse impacted the Arab world,6,128,0,0.94,2023-12-24 10:13:23,Article,Hot,8.0
1127,Why Does Santa Claus Live in the North Pole? | Polar Stories,10,20,0,0.64,2023-12-24 19:42:25,Article,Hot,25.0
1128,Weekly History Questions Thread.,47,62,0,0.85,2023-12-23 13:00:25,Discussion/Question,Hot,4.0
1129,King Henry VII and the case of the missing treaty,3,64,0,0.89,2023-12-23 11:58:10,Article,Hot,10.0
1130,Archaeologists find earliest multiplication formulas on record,9,275,0,0.85,2023-12-22 02:06:28,Article,Hot,33.0
1131,"This 2,300-year-old mosaic made of shells and coral has just been found buried under Rome",17,459,0,0.96,2023-12-21 13:49:29,Article,Hot,53.0
1132,Human and animal skin identified by palaeoproteomics in Scythian leather objects from Ukraine,6,333,0,0.94,2023-12-20 17:17:54,Article,Hot,113.0
1133,Bookclub and Sources Wednesday!,22,45,0,0.84,2023-12-20 12:00:30,Discussion/Question,Hot,5.0
1134,Maya mortuary deposits found in cave at Tulum,2,46,0,0.87,2023-12-20 06:18:13,Article,Hot,3.0
1135,"DNA sleuths crack 2,000 year-old migrant mystery",17,251,0,0.92,2023-12-19 18:03:53,Article,Hot,1.0
1136,"Ancient ""curse tablet"" targeting unlucky pair unearthed by archaeologists in Germany",40,389,0,0.93,2023-12-19 01:17:04,,Hot,1.0
1137,"If you were to ask me who the most inspirational, competent, effective person in human history is, I'd point to Spartacus.",61,0,0,0.34,2023-12-20 03:11:29,Discussion/Question,Hot,35.0
1138,"Archaeologists Discover ""Bakery-Prison"" at Pompeii",12,304,0,0.92,2023-12-17 03:38:40,,Hot,1.0
1139,Weekly History Questions Thread.,97,38,0,0.76,2023-12-16 13:00:30,Discussion/Question,Hot,4.0
1140,“Sew for Victory!” How Women During World War II Used Their Domesticity to Aid the Cause,11,137,0,0.84,2023-12-15 18:02:12,Article,Hot,12.0
1141,"After observing Native American medical practices, Europeans began administering tobacco smoke enemas, often to revive the unconscious. In the 1780s, first-aid kits were installed along the Thames River for drowning victims, complete with tools for blowing smoke into the rectum.",110,1267,0,0.95,2023-12-14 07:25:45,Article,Hot,786.0
1142,Why the Oracle of Delphi Still Beguiles,2,40,0,0.88,2023-12-14 06:51:00,Article,Hot,9.0
1143,"We are reporters with The Washington Post. We spent two years investigating the disappearance of the remains of Grenada’s revolutionary leader, Maurice Bishop — and trying to determine if the United States government had anything to do with it. Ask us anything!",83,451,0,0.72,2023-12-13 17:24:33,AMA,Hot,152.0
1144,"The Long Legends: Transcription, Translation, and Commentary. The long legends on the Carta marina will be addressed sheet by sheet, and within each sheet, from left to right and top to bottom.",2,23,0,0.83,2023-12-14 00:35:45,Article,Hot,2.0
1145,Bookclub and Sources Wednesday!,55,43,0,0.85,2023-12-13 12:00:27,Discussion/Question,Hot,4.0
1146,"The grim history of the Tullianum, an early Roman prison where high status criminals were held before sentencing could be carried out. Due to its importance in Christian legend, the site has been preserved and protected into the present day.",11,274,0,0.93,2023-12-12 21:40:18,,Hot,1.0
1147,"An interesting historical anecdote that was recorded in a primary source written in the Manchu language about how the women of the horde fought in the war, along with my own English translation",12,267,0,0.91,2023-12-11 19:10:13,Article,Hot,18.0
1148,The Aftermath at Stalingrad | BATTLESTORM STALINGRAD E51 (FINALE),18,21,0,0.6,2023-12-11 19:40:44,Video,Hot,-1.0
1149,How Did Christianity Change the Roman Empire?,113,172,0,0.84,2023-12-11 07:12:09,Article,Hot,1.0
1150,Iron Age: How Wales was ruled from hillforts pre-Romans,6,264,0,0.95,2023-12-10 17:36:23,,Hot,33.0
1151,Weekly History Questions Thread.,69,43,0,0.82,2023-12-09 13:00:28,Discussion/Question,Hot,6.0
1152,"Free course ""A HISTORY OF DENMARK FROM THE VIKING AGE TO THE 21ST CENTURY "" made by Aarhus University.",24,277,0,0.94,2023-12-08 21:07:53,Article,Hot,15.0
1153,"The History of Bipolar Disorder: An Untold Story. Cycles of mania, depression and psychosis were ever present throughout human history.",8,55,0,0.76,2023-12-08 21:12:48,Video,Hot,1.0
1154,Temple linked to Hercules and Alexander the Great discovered in ancient megacity in Iraq,7,569,0,0.98,2023-12-08 02:24:22,Science site article,Hot,31.0
1155,Kevin Bair Fall of the Natural Ice Trade Presentation WCHS 11 14 1,0,11,0,0.76,2023-12-08 22:28:26,Article,Hot,
1156,"Long thought lost, a controversial plaque from 1915 commemorating the construction of the Albert Barracks Wall in Auckland has been found during a renovation of a nearby university building",6,139,0,0.91,2023-12-07 19:49:59,Article,Hot,1.0
1157,The Laughing Cavalier: The masterpiece that became a meme,0,47,0,0.87,2023-12-07 16:11:27,Article,Hot,
1158,Hans Holbein the Younger: The 16th-Century painter who created ‘a Tinder for Tudors’,18,419,0,0.92,2023-12-07 00:00:25,Article,Hot,85.0
1159,Bookclub and Sources Wednesday!,21,51,0,0.79,2023-12-06 12:00:42,Discussion/Question,Hot,5.0
1160,Longstreet: the Confederate general who switched sides on race,116,691,0,0.92,2023-12-04 17:28:27,Article,Hot,240.0
1161,France’s Long March Against Racism,2,22,0,0.64,2023-12-05 07:34:37,Article,Hot,5.0
1162,The Stone Age Revisited: Unearthing Neolithic Mysteries in the Arabian Desert,1,168,0,0.89,2023-12-03 20:08:03,Article,Hot,30.0
1163,Weekly History Questions Thread.,64,48,0,0.74,2023-12-02 13:00:31,Discussion/Question,Hot,5.0
1164,Roman Infantry Tactics: Why the Pilum and not a Spear?,83,349,0,0.91,2023-12-01 14:36:26,Article,Hot,296.0
1165,Henry Kissinger: The Declassified Obituary,19,154,0,0.89,2023-11-30 17:14:54,Article,Hot,1.0
1166,The First Christmas Tree,0,14,0,0.73,2023-12-01 05:50:10,Article,Hot,
1167,"My word: The eccentric, nude Queenslander who helped shape the English language",2,28,0,0.74,2023-11-30 17:29:36,Article,Hot,4.0
1168,"Aztec sacrifice didn't end with the victims’ death. In many cities, the victim's skull had a hole drilled through, and then was displayed on racks with hundreds of others, with the largest holding more than 650.",111,668,0,0.92,2023-11-29 22:04:51,Article,Hot,216.0
1169,"Final part of podcast on thalidomide. Launched in 1957, the drug is one of the greatest failures in medicine’s history. A new 6 year investigation examining FDA data & documents from the 1960s, suggests, although never approved in the US, there were around 5 million doses of the drug in circulation",10,29,0,0.78,2023-11-30 12:56:56,Podcast,Hot,3.0
1170,"Who was Letizia Bonaparte, the mother of Napoleon?",2,37,0,0.75,2023-11-29 23:06:04,Article,Hot,1.0
1171,Bookclub and Sources Wednesday!,34,39,0,0.81,2023-11-29 12:00:33,Discussion/Question,Hot,4.0
1172,Peopling the Past: The Libyans,5,81,0,0.79,2023-11-29 08:22:58,,Hot,9.0
1173,"Gerbils and Silk Road are to blame for the black plague in Europe during the Middle Ages, but not rats",34,338,0,0.83,2023-11-28 11:59:55,Article,Hot,83.0
1174,Archaeology: Why early women were equally handy hunters as men,59,0,0,0.35,2023-11-30 08:41:08,Article,Hot,170.0
1175,The 1600s Were a Watershed for Swear Words,13,210,0,0.92,2023-11-27 07:17:44,Article,Hot,31.0
1176,Ancient Egyptian temple ceiling restoration complete: Experts uncovered hundreds of mythological and astronomical figures in five-year joint project between the Egyptian Ministry of Tourism and Antiquities and the University of Tübingen,11,359,0,0.94,2023-11-26 21:01:28,Article,Hot,10.0
1177,On biography as a form of history writing – how does a biographer balance storytelling with the truth?,2,24,0,0.73,2023-11-26 10:30:11,Article,Hot,3.0
1178,"The Greeks and Romans portrayed Druids as bogeymen who bathed in their victims’ blood, but what can archaeology tell us about the Druids’ dark arts?",77,775,0,0.93,2023-11-25 05:49:41,,Hot,72.0
1179,"'Magical' Roman wind chime with phallus, believed to ward off evil eye, unearthed in Serbia",8,283,0,0.91,2023-11-25 09:01:35,Science site article,Hot,21.0
1180,Weekly History Questions Thread.,45,18,0,0.75,2023-11-25 13:00:36,Discussion/Question,Hot,6.0
1181,"'Remarkable' 1,400-year-old possible temple found",8,288,0,0.93,2023-11-23 11:38:20,Article,Hot,77.0
1182,Periphery of a Genocide: Finland and the Holocaust | Holocaust and Genocide Studies,3,72,0,0.87,2023-11-23 14:50:55,Article,Hot,1.0
1183,"Indigenous Mexicans migrated to California 5,200 years ago, likely bringing their languages with them, ancient DNA reveals",85,1442,0,0.91,2023-11-22 21:59:02,Article,Hot,262.0
1184,Austerlitz: how Napoleon crushed the Austro-Russian army,5,128,0,0.91,2023-11-23 06:51:49,Article,Hot,26.0
1185,Podcast telling the story of one of the most tragic stories in the history of medicine - the launch of the drug thalidomide in 1957. Journalist Jennifer Vanderbes discusses new historical documents & data that have been uncovered about warnings and tests that were misrepresented in the 1950s & 1960s,21,163,0,0.89,2023-11-22 16:53:06,Podcast,Hot,1.0
1186,"Podcast Episode: ""Why William Wallace?"" with Owen Innes from the Scottish History Podcast",13,26,0,0.8,2023-11-22 17:56:18,Article,Hot,7.0
1187,"The first News Coverage of JFK on Friday, 11/22/1963",1,25,0,0.75,2023-11-22 13:11:27,Video,Hot,3.0
1188,"Your guide to the Anarchy, the bloody battle between Stephen and Matilda",0,52,0,0.86,2023-11-22 07:20:20,Article,Hot,
1189,Bookclub and Sources Wednesday!,16,21,0,0.72,2023-11-22 12:00:33,Discussion/Question,Hot,5.0
1190,Looking for the first television ads that advertised TVs,3,26,0,0.83,2023-11-21 23:05:44,Discussion/Question,Hot,4.0
1191,Maya warrior statue with serpent helmet discovered at Chichén Itzá,12,410,0,0.94,2023-11-21 00:20:34,Article,Hot,18.0
1192,King Stephen medieval penny hoard found near Wymondham,45,459,0,0.94,2023-11-20 07:00:09,Article,Hot,1.0
1193,That’s not a potato: mystery of Egyptian treasures found buried in grounds of Scottish school | Archaeology,19,686,0,0.96,2023-11-19 17:53:01,News article,Hot,182.0
1194,"How mathematics built the modern world: the cornerstone of the Industrial Revolution and a new paradigm of measurement and calculation, it was more than scientific discovery, built industry, modernity, and the world we inhabit today",40,528,0,0.95,2023-11-18 10:51:28,Article,Hot,32.0
1195,The truth about Viking berserkers,124,760,0,0.93,2023-11-18 07:06:16,Article,Hot,794.0
1196,Weekly History Questions Thread.,83,25,0,0.77,2023-11-18 13:00:29,Discussion/Question,Hot,3.0
1197,Life in East Germany: the cultural evolution behind the Iron Curtain,2,148,0,0.92,2023-11-17 20:36:17,Article,Hot,20.0
1198,Surrealism in Egypt ‘Long Live Degenerate Art’,0,66,0,0.91,2023-11-18 00:16:10,,Hot,
1199,The First Scientist’s Guide to Truth: Alhazen on Critical Thinking,2,142,0,0.85,2023-11-16 20:32:42,Article,Hot,23.0
1200,The Youngest Daughter of the Sciences: Electrical performances shocked upper-class eighteenth-century audiences,0,76,0,0.91,2023-11-16 11:52:35,Article,Hot,
1201,Indigenous Kings in Londontown,4,137,0,0.86,2023-11-16 07:31:42,Article,Hot,7.0
1202,Scandalous sisters: how three French princesses brought down the Capetian dynasty,31,572,0,0.93,2023-11-15 11:34:08,Article,Hot,1.0
1203,"A boy speaking gibberish appeared in the 1700s on a Virginia dock in mysterious circumstances. His odd language was Portuguese, and a home was found for him. This boy grew up to be Pedro Francisco, the ""Virginia Hercules"", and a hero of the Revolutionary War.",28,887,0,0.95,2023-11-14 18:35:15,Article,Hot,228.0
1204,Bookclub and Sources Wednesday!,10,27,0,0.89,2023-11-15 12:00:35,Discussion/Question,Hot,5.0
1205,"The Aëthnic Union, Urania and abolishing the gender binary",3,3,0,0.51,2023-11-15 19:17:48,Article,Hot,4.0
1206,"The etymology of 'orchestra', and history of performance theatre, in ancient Greece",3,107,0,0.88,2023-11-14 10:27:22,,Hot,4.0
1207,The Largest Ancient Floor Mosaic in Cappadocia and Central Anatolia Region Uncovered -600 square meters-,11,421,0,0.95,2023-11-13 18:10:07,Article,Hot,31.0
1208,Widespread steel making process in the north 2000 years ago - Luleå University of Technology,10,84,0,0.9,2023-11-13 23:06:00,Article,Hot,10.0
1209,The Welsh history of Philadelphia,20,193,0,0.88,2023-11-12 12:29:29,,Hot,38.0
1210,"How mapping won the battle of Vimy Ridge, 1917",9,143,0,0.91,2023-11-11 21:35:54,Video,Hot,6.0
1211,Weekly History Questions Thread.,81,48,0,0.84,2023-11-11 13:00:30,Discussion/Question,Hot,3.0
1212,AI Is Used To Share What Ancient Languages Sounded Like,20,0,0,0.28,2023-11-12 14:05:03,Article,Hot,94.0
1213,Tomb of ancient Egyptian Late Period royal scribe named Djehutyemnakht unearthed in Abusir necropolis by Czech Egyptologists,0,368,0,0.96,2023-11-09 18:44:38,Article,Hot,
1214,"Podcast Episode: ""Women in the Scottish Wars of Independence"" with Beth Reid",2,40,0,0.74,2023-11-09 20:34:00,Podcast,Hot,4.0
1215,"Himmler ordered mass execution of prisoners in only Nazi camp on British soil, documents reveal",94,1882,0,0.95,2023-11-08 07:08:03,Article,Hot,920.0
1216,Reframing the Thanksgiving Narrative,25,0,0,0.45,2023-11-10 15:45:42,,Hot,69.0
1217,"The ""Byzantines"" Were Not Called Roman by Most of the Medieval World, Including the East",50,0,0,0.37,2023-11-10 17:17:49,,Hot,135.0
1218,‘Holy grail of shipwrecks’ to be raised along with $20bn of treasure,139,2654,0,0.98,2023-11-07 18:45:42,Article,Hot,230.0
1219,Bookclub and Sources Wednesday!,8,18,0,0.81,2023-11-08 12:00:37,Discussion/Question,Hot,4.0
1220,Letters from Seven Years' War opened 250 years later,66,461,0,0.96,2023-11-07 07:21:53,Article,Hot,237.0
1221,"Archaeologists uncovered over 100,000 ancient coins, some more than 2,000 years old",36,868,0,0.96,2023-11-06 13:08:15,Article,Hot,237.0
1222,Stone Age skeletons in Spain reveal earliest known large-scale war in Europe c. 5000 years ago,25,515,0,0.97,2023-11-06 13:22:58,Article,Hot,109.0
1223,A Report on the Timing of the Development of Small-Incision Cataract Surgery by Charles Kelman in the 1960s.,4,119,0,0.91,2023-11-05 23:51:48,Article,Hot,9.0
1224,Archaeologists Discover Electoral Campaign Inscription Inside Pompeii House,4,308,0,0.97,2023-11-04 04:47:18,Article,Hot,38.0
1225,Weekly History Questions Thread.,69,46,0,0.82,2023-11-04 13:00:40,Discussion/Question,Hot,7.0
1226,"New study suggests the Gunung in Indonesia Padang is the world's oldest pyramid possibly dating as far back as 27,000 years ago",24,330,0,0.79,2023-11-03 22:53:43,PDF,Hot,181.0
1227,AI revealed the colorful first word of an ancient scroll torched by Mount Vesuvius,12,295,0,0.85,2023-11-03 15:33:36,Article,Hot,94.0
1228,"Stunning 2,700-Year-Old Sculpture Unearthed in Iraq",23,559,0,0.89,2023-11-02 11:08:22,Article,Hot,242.0
1229,What was Japanese leadership’s view of the likelihood of a steady atomic supply by the Allies?,46,46,0,0.79,2023-11-02 04:32:33,Discussion/Question,Hot,36.0
1230,Archaeologists reveal face of Peru's 'Ice Maiden' mummy,58,728,0,0.94,2023-11-01 07:17:14,Article,Hot,161.0
1231,Seattle Buried Its Old Downtown and Now the Tunnels are Filled with Corpses and Zombie Spiders,25,339,0,0.82,2023-11-01 04:26:07,Article,Hot,288.0
1232,Bookclub and Sources Wednesday!,27,28,0,0.87,2023-11-01 12:01:35,Discussion/Question,Hot,9.0
1233,Why Is the United States Hostile to Socialism?,325,30,0,0.52,2023-11-01 11:41:18,Article,Hot,1.0
1234,Ancient temple dedicated to Kukulcán found at El Tigre archaeological site in Campeche,16,456,0,0.95,2023-10-31 14:18:13,Article,Hot,82.0
1235,An interdisciplinary project led by primatologist Gisela Kopp is using genetic analysis to determine the geographic origin of mummified baboons found in ancient Egypt. The team finds evidence that the two legendary trading regions of Punt and Adulis may have been the same place,2,157,0,0.94,2023-10-29 23:21:49,Article,Hot,11.0
1236,"Rare 2,100-year-old gold coin bears name of obscure ruler from pre-Roman Britain",23,1054,0,0.97,2023-10-29 10:33:59,Article,Hot,243.0
1237,Did Ancient Egyptians Know Meteorites Came From Space?,17,261,0,0.89,2023-10-28 20:56:55,Article,Hot,131.0
1238,Declassified documents show attempts of Soviet foreign intelligence to persuade Nestor Makhno's wife Halyna to collect information about insurgent ataman's plans,0,51,0,0.89,2023-10-28 18:07:37,Article,Hot,
1239,Weekly History Questions Thread.,45,42,0,0.83,2023-10-28 12:00:19,Discussion/Question,Hot,3.0
1240,A wall or a road? A remote sensing-based investigation of fortifications on Rome's eastern frontier,4,120,0,0.92,2023-10-27 12:10:21,,Hot,1.0
1241,"350 Years Ago, A ‘Naughty’ Female Nude Got Painted Over. Tech Just Undressed It",54,1466,0,0.93,2023-10-26 18:50:19,Article,Hot,355.0
1242,Did medieval peasants have more vacation time than us?,90,303,0,0.83,2023-10-26 14:16:46,Article,Hot,456.0
1243,October 26th - Smallpox Eradication Day,20,170,0,0.91,2023-10-26 12:34:57,Trivia,Hot,1.0
1244,The History of the Cape Town Train Station,3,25,0,0.91,2023-10-26 14:34:14,Article,Hot,2.0
1245,'World-class aquifer' enabled ancient African kingdom to thrive in the Sahara for hundreds of years,11,614,0,0.95,2023-10-25 11:18:39,Article,Hot,1.0
1246,I built a 360 tour of the battleship Iowa!,7,112,0,0.92,2023-10-25 18:08:52,,Hot,5.0
1247,Brazil drought reveals ancient rock carvings of human faces,33,954,0,0.98,2023-10-24 16:45:43,News article,Hot,240.0
1248,Bookclub and Sources Wednesday!,34,27,0,0.92,2023-10-25 11:00:35,Discussion/Question,Hot,6.0
1249,The German Army Toppled a Pioneering Radical Government and Opened the Way for Nazism,59,297,0,0.72,2023-10-23 22:44:48,Article,Hot,1.0
1250,That Time the Nazis Claimed a Chunk of Antarctica | Polar Stories,23,431,0,0.93,2023-10-22 13:48:11,Article,Hot,13.0
1251,Stories told by Aboriginal Tasmanians could be oldest recorded in the world,46,594,0,0.92,2023-10-21 23:24:28,Science site article,Hot,206.0
1252,"A crumbling, long-forgotten statue with an unusual erect phallus might be a Michelangelo. Renaissance scholars want hard evidence.",8,714,0,0.93,2023-10-21 19:23:21,Article,Hot,1.0
1253,HMS Thistle found 83 years after it was torpedoed in WWII battle,10,337,0,0.92,2023-10-21 12:37:36,Article,Hot,161.0
1254,"Egyptian mission uncovers New Kingdom cemetery, papyrus in Minya",1,258,0,0.94,2023-10-21 00:01:50,Article,Hot,-3.0
1255,"Who was allowed to call the Roman empire home? Vandals, Goths, Alemanni, Sueves: the Romans grappled endlessly with the status of ethnic peoples in their vast empire",5,111,0,0.9,2023-10-21 01:03:47,,Hot,9.0
1256,Weekly History Questions Thread.,60,15,0,0.76,2023-10-21 12:00:20,Discussion/Question,Hot,3.0
1257,History of beaumaris castle,2,74,0,0.85,2023-10-20 12:12:45,Article,Hot,1.0
1258,Fortified Settlement of Zambujal - English Version,1,12,0,0.72,2023-10-20 08:54:51,Article,Hot,3.0
1259,"2,000-year-old 'Tomb of Cerberus' with stunning frescoes discovered in Italy",20,1225,0,0.97,2023-10-18 05:15:00,,Hot,200.0
1260,Bookclub and Sources Wednesday!,25,18,0,0.83,2023-10-18 11:00:42,Discussion/Question,Hot,5.0
1261,Reading Visual Art: The Virgin Mary and the Snake,1,19,0,0.83,2023-10-18 06:57:33,,Hot,2.0
1262,Sioux City’s Corn Palaces,16,136,0,0.87,2023-10-17 02:44:26,Video,Hot,24.0
1263,Collections: Ancient Greek and Phoenician Colonization,9,162,0,0.9,2023-10-16 20:01:25,Article,Hot,2.0
1264,Museum of Atheism - help out by filling in some surveys!,26,0,0,0.41,2023-10-18 11:46:57,Discussion/Question,Hot,18.0
1265,The migration of cataract surgery to the New World after 1492,17,184,0,0.89,2023-10-16 02:14:05,Article,Hot,27.0
1266,Weekly History Questions Thread.,80,49,0,0.8,2023-10-14 12:00:30,Discussion/Question,Hot,6.0
1267,Scientists discover traces of paint on the Parthenon Sculptures that reveal their true colours,47,1009,0,0.97,2023-10-13 11:11:35,Article,Hot,375.0
1268,First word discovered in unopened Herculaneum scroll by 21yo computer science student,41,1642,0,0.96,2023-10-12 22:07:42,Article,Hot,1.0
1269,3500-year-old mysterious hieroglyphs discovered in Yerkapı Tunnel in Hattusa deciphered,9,660,0,0.96,2023-10-12 17:15:10,Article,Hot,1.0
1270,World War Two experimental catapult unearthed by archaeologists,20,394,0,0.95,2023-10-11 12:38:54,Article,Hot,84.0
1271,"In France, researchers use experimental archaeology to build a castle from scratch the 13th century way",34,992,0,0.96,2023-10-11 01:22:57,,Hot,235.0
1272,Ancient Skulls Reveal Shifts in Human Violence across Millennia,17,181,0,0.95,2023-10-11 01:47:50,Article,Hot,1.0
1273,Bookclub and Sources Wednesday!,34,29,0,0.88,2023-10-11 11:00:41,Discussion/Question,Hot,4.0
1274,Coin hoard could be linked to 1692's Glencoe Massacre,15,358,0,0.94,2023-10-09 06:23:57,Article,Hot,56.0
1275,Two Colonizers in South Africa: The British vs. The Dutch,62,257,0,0.8,2023-10-07 11:58:31,Article,Hot,26.0
1276,Researchers say Alaska Native knowledge can help solve the mystery of ancient bear bones,10,450,0,0.91,2023-10-06 21:55:22,Article,Hot,12.0
1277,Weekly History Questions Thread.,48,28,0,0.81,2023-10-07 12:00:22,Discussion/Question,Hot,5.0
1278,"Tests confirm humans tramped around North America more than 20,000 years ago",60,2382,0,0.97,2023-10-05 21:22:44,Article,Hot,1.0
1279,Archaeologists Discovered a Lost Ancient Temple of Legend In Mexico,6,192,0,0.93,2023-10-05 19:57:39,Article,Hot,32.0
1280,Mandalada – the Nenets movement against Soviet collectivization in the tundra,1,11,0,1.0,2023-10-06 10:04:36,Article,Hot,1.0
1281,The Gallowglass two-handed axe,8,103,0,0.82,2023-10-05 08:49:36,Video,Hot,14.0
1282,Bookclub and Sources Wednesday!,27,40,0,0.78,2023-10-04 11:00:50,Discussion/Question,Hot,6.0
1283,"5,000-Year-Old Wine Jars Found Intact at Abydos in Sohag",31,638,0,0.96,2023-10-03 17:00:02,Article,Hot,74.0
1284,Memories of Project RAMOS (Russian American Observation Satellites) 1991 – 2004,2,20,0,0.78,2023-10-03 20:40:12,Article,Hot,6.0
1285,Gilleleje: Denmark's seaside town that saved Danish Jews During WWII.,19,287,0,0.91,2023-10-03 04:32:10,,Hot,17.0
1286,"From Scotland to Canada, a totem pole finally returns home",7,321,0,0.87,2023-10-02 07:06:38,Article,Hot,7.0
1287,Holocaust Memorial Day Trust | Disabled people,6,51,0,0.8,2023-10-02 03:44:11,Article,Hot,18.0
1288,New statues found in Göbeklitepe and Karahantepe: The first painted neolithic statue was discovered,34,750,0,0.97,2023-09-30 15:23:55,Article,Hot,187.0
1289,Interesting Alliances: The Vikings of Byzantium,15,77,0,0.9,2023-09-30 18:22:59,Article,Hot,30.0
1290,A portrait of Tenochtitlan in 3D,46,571,0,0.98,2023-09-29 23:30:30,Article,Hot,34.0
1291,Weekly History Questions Thread.,57,12,0,0.83,2023-09-30 12:00:25,Discussion/Question,Hot,4.0
1292,Opinion | What Kind of Person Has a Closet Full of Nazi Memorabilia? (Gift Article),147,259,0,0.81,2023-09-29 18:33:08,Discussion/Question,Hot,336.0
1293,Archaeologists Find Hidden Rooms in Pyramid of Egyptian Pharaoh Sahure,6,55,0,0.92,2023-09-29 22:22:09,Article,Hot,3.0
1294,Europe's oldest shoe found in Spanish bat cave,4,344,0,0.93,2023-09-29 07:40:48,,Hot,1.0
1295,"Students made Oxford the murder capital of late medieval England, research suggests",20,539,0,0.96,2023-09-28 13:32:24,Science site article,Hot,168.0
1296,The Medieval University Experience,2,84,0,0.89,2023-09-28 16:36:53,Article,Hot,9.0
1297,"In 1956, the Soviets held first place — briefly",3,24,0,0.73,2023-09-28 12:42:09,Article,Hot,18.0
1298,A new Indo-European Language discovered in the Hittite capital Hattusa.,12,705,0,0.97,2023-09-27 15:19:46,Article,Hot,187.0
1299,The History of the Blood Countess,2,36,0,0.83,2023-09-27 18:16:48,Science site article,Hot,12.0
1300,The Dancing Plague of 1518,10,32,0,0.78,2023-09-27 14:48:33,Article,Hot,13.0
1301,Bookclub and Sources Wednesday!,17,41,0,0.81,2023-09-27 11:00:33,Discussion/Question,Hot,3.0
1302,Archaeologists uncover tomb of Emperor Xiaomin of Northern Zhou,15,430,0,0.95,2023-09-26 18:45:41,Article,Hot,80.0
1303,3d Scan of the Tomb of Ramesses I (KV 16),1,65,0,0.93,2023-09-26 13:09:56,Article,Hot,2.0
1304,Bramah’s ‘Challenge Lock’ Went Unpicked for 67 Years Until a Rival Locksmith Took Up the Challenge at the Great Exhibition of 1851,16,681,0,0.96,2023-09-24 23:24:13,Article,Hot,1.0
1305,OPEC Oil Crisis 1973 Explained on Maps,2,15,0,0.67,2023-09-25 14:03:44,Video,Hot,1.0
1306,Unraveling the Myths of First Lady Dolley Madison,6,131,0,0.87,2023-09-24 01:29:55,,Hot,18.0
