Post_Index,Title,Num_Comments,Upvotes,Downvotes,Upvote_Ratio,Date_Posted,Flair,Post_Category,Top_Comment_Score
1683,"Ultraviolet photography reveals ca. 1,750-year-old New Testament translation — a fragment now considered as the fourth manuscript witness to the Old Syriac Gospels",97,3046,0,0.97,2023-04-11 11:10:32,Article,Hot,314.0
1684,"A discussion on garum, an ancient Roman fish sauce, and the evidence for kosher varieties.",77,2122,0,0.94,2023-04-11 00:02:05,Article,Hot,179.0
1685,"Where You Can Discover England’s Lost Jewish Past - The New York Times: Around eight centuries ago, Jews thrived in England, worshiping freely and living where they pleased. Then everything changed. You can uncover their stories, if you know where to look.",5,98,0,0.87,2023-04-11 02:33:38,Article,Hot,12.0
1686,"Album from 1961 examining the 1956 United States presidential election using recordings of speeches, interviews, and conventions",2,54,0,0.98,2023-04-11 01:48:03,,Hot,0.0
1687,"The Early History of Extracting Cataracts and Visual Axis Opacities by Pulling Them out of the Eye: from Scacchi in 1596, to Pallucci and Daviel in 1750.",53,1485,0,0.95,2023-04-10 02:01:10,Article,Hot,210.0
1688,Between a rock and a high place: Picturing Bedouin geographies in Ibn Sbayyil’s Arabian Romantic,2,416,0,0.96,2023-04-10 07:11:31,Article,Hot,21.0
1689,"Was She Really Rosie? The exploration of the origins of ""Rosie the Riveter"" and its impact on feminism and women's work.",5,107,0,0.82,2023-04-10 01:25:48,Article,Hot,1.0
1690,"Experts reveal digital image of what an Egyptian man looked like almost 35,000 years ago",295,4173,0,0.88,2023-04-09 01:28:09,Article,Hot,2259.0
1691,The weapons of the Landknechts,60,1727,0,0.93,2023-04-08 10:49:54,Video,Hot,130.0
1692,The American Revolution’s Forgotten War Crime - Extra History,0,38,0,0.79,2023-04-09 00:12:46,Video,Hot,
1693,Weekly History Questions Thread.,94,31,0,0.86,2023-04-08 12:00:26,Discussion/Question,Hot,6.0
1694,Ancient Egyptian pit of severed hands 'could be evidence of battle ritual’,84,3906,0,0.97,2023-04-07 07:44:10,Article,Hot,327.0
1695,"Shackleton’s Expedition to Antarctica on The Endurance: The photographic journey of one of the greatest survival stories ever told, 1914-1917",140,3326,0,0.97,2023-04-06 15:25:43,Image Gallery,Hot,482.0
1696,"Benin Bronzes are made of brass manillas that originated from the German Rhineland, between the 15th and 18th centuries",29,279,0,0.94,2023-04-07 00:31:29,Article,Hot,37.0
1697,The Katzbalger sword,2,53,0,0.85,2023-04-07 08:53:26,Video,Hot,5.0
1698,Research shines new light on the Stone of Destiny,0,47,0,0.85,2023-04-07 07:41:49,Article,Hot,
1699,Truman’s Secret Plea to Eisenhower: Take My Job,12,61,0,0.88,2023-04-06 23:58:10,Article,Hot,1.0
1700,"Spanish horses were deeply integrated into Indigenous societies across western North America, by 1599 CE — long before the arrival of Europeans in that region",408,5575,0,0.94,2023-04-05 01:04:42,Article,Hot,1.0
1701,Bookclub and Sources Wednesday!,38,108,0,0.92,2023-04-05 11:00:40,Discussion/Question,Hot,11.0
1702,The fundamentals of Renaissance and Early Modern Pike warfare,73,2267,0,0.96,2023-04-04 06:39:07,Video,Hot,246.0
1703,Supernatural beliefs have featured in every society throughout history. New research helps explain why,32,158,0,0.88,2023-04-04 03:57:25,Article,Hot,1.0
1704,19th Century Plaster Casts from Pompeii Tell the Story of Tragedy,70,2260,0,0.96,2023-04-03 09:13:24,Article,Hot,252.0
1705,Ancient African empires’ impact on migration revealed by genetics,17,296,0,0.92,2023-04-03 18:49:12,Article,Hot,15.0
1706,The Epic Story of the March of the Ten Thousand Greek Hoplites,35,632,0,0.95,2023-04-02 22:05:32,Article,Hot,128.0
1707,Evidence for early yak milk consumption by Mongolian Elites,39,1947,0,0.97,2023-04-02 15:08:50,Article,Hot,152.0
1708,"Hi r/History I am Internationally Renowned Historian and Archaeologist Graham Hancock, Ask Me Anything",46,750,0,0.72,2023-04-01 16:42:53,AMA,Hot,1.0
1709,"New radiocarbon and ceramic evidence dates the destruction of Zincirli, Türkiye, to late 17th century BCE — with implications for the start of the Late Bronze Age, and the rise of empires",20,1872,0,0.95,2023-04-01 10:22:14,Article,Hot,1.0
1710,AMA Announcement: r/History is pleased to announce that distinguished Historian and Archaeologist Graham Hancock will be joining us for an AMA later today,0,222,0,0.72,2023-04-01 08:24:08,AMA,Hot,
1711,This Zurich bar was once a meeting place for a secret gay society,15,616,0,0.85,2023-03-31 22:05:30,Article,Hot,25.0
1712,Weekly History Questions Thread.,120,44,0,0.9,2023-04-01 12:00:49,Discussion/Question,Hot,1.0
1713,Clues to the Lives of North America’s First Inhabitants Are Hidden Underwater,54,2251,0,0.97,2023-03-31 12:20:32,Article,Hot,306.0
1714,Proper and improper restoration; featuring a 15th century dagger.,4,77,0,0.88,2023-03-31 18:40:13,Article,Hot,3.0
1715,"Ancient DNA reveals that southwest Asian migrants from Persia intermingled with African people along the Swahili coast, around 1000 CE — findings that align with the oldest Swahili oral stories",168,4638,0,0.97,2023-03-30 09:43:41,Article,Hot,244.0
1716,"Gods, tombs and Nazis: the Third Reich’s bad relationship with Egyptology",75,3163,0,0.95,2023-03-29 22:26:24,Article,Hot,1.0
1717,When Sidney Poitier (& Harry Belafonte) risked his life for civil rights - 1964,6,118,0,0.9,2023-03-30 14:21:31,News article,Hot,5.0
1718,The 'Stonehenge calendar' shown to be a modern construct,13,136,0,0.85,2023-03-30 09:33:34,Science site article,Hot,60.0
1719,Bookclub and Sources Wednesday!,95,393,0,0.91,2023-03-29 11:00:43,Discussion/Question,Hot,15.0
1720,"19th century impressionistic paintings by Turner and Monet depict realism of air pollution, that increased to unprecedented levels during the Industrial Revolution",31,1388,0,0.96,2023-03-27 11:45:40,Article,Hot,126.0
1721,"Oldest tartan found to date back to 16th Century - A scrap of fabric found in a Highland peat bog 40 years ago is likely to be the oldest tartan ever discovered in Scotland, new tests have established.",162,4775,0,0.98,2023-03-27 02:39:23,Article,Hot,752.0
1722,"Over 2,000 Mummified Sheep Heads Unearthed In Egypt Temple",69,2851,0,0.98,2023-03-26 15:41:49,Article,Hot,562.0
1723,Circassian Genocide - How Russia Took Over the Caucasus DOCUMENTARY,16,385,0,0.88,2023-03-26 19:55:32,Video,Hot,1.0
1724,A Super Quick History of Bulgaria,33,845,0,0.91,2023-03-26 08:22:52,Video,Hot,71.0
1725,The ancient Chinese halberd,39,618,0,0.83,2023-03-25 10:08:20,Video,Hot,175.0
1726,Weekly History Questions Thread.,143,129,0,0.91,2023-03-25 13:00:38,Discussion/Question,Hot,7.0
1727,Ptolemy’s treatise on the meteoroscope recovered,5,1101,0,0.95,2023-03-25 00:02:26,PDF,Hot,85.0
1728,"Various statements by Zhu Yuanzhang the Emperor Hongwu, founder of the Ming Dynasty, about the Yuan Dynasty.",7,213,0,0.91,2023-03-25 07:53:54,Article,Hot,20.0
1729,The Song Dynasty crossbow,59,1410,0,0.93,2023-03-24 11:45:56,Video,Hot,115.0
1730,"In the 1990s over 1,200 bones from roughly 15 bodies were found buried in Benjamin Franklin's London house, they are believed to be the remains from an anatomy school founded by an associate of Franklin's.",43,3898,0,0.98,2023-03-23 14:07:31,Article,Hot,629.0
1731,"Representation of zodiac and star constellations, rare in Egyptian temples, uncovered at the Temple of Esna vestibule built ca. 41–54 CE",1,388,0,0.96,2023-03-23 17:59:53,Article,Hot,17.0
1732,Ancient Egyptians depended on international trade to preserve bodies over embalming techniques,4,265,0,0.94,2023-03-23 14:19:43,Article,Hot,7.0
1733,One of the oldest surviving Bible could be yours — for $30 million,147,3169,0,0.89,2023-03-23 00:52:12,Article,Hot,1.0
1734,We used DNA from Beethoven's hair to shed light on his poor health – and stumbled upon a family secret,7,65,0,0.86,2023-03-23 12:31:14,Article,Hot,43.0
1735,"I found a diary written in Manchus language, the author was a Manchus soldier served in a combined unit of Manchus and Mongols in 17th century. I never have read something like this before. So I decided to translate part of it to English with original Manchu text and my own commentary in bold text.",212,7582,0,0.97,2023-03-21 22:53:49,Article,Hot,592.0
1736,Bookclub and Sources Wednesday!,23,77,0,0.97,2023-03-22 12:00:44,Discussion/Question,Hot,5.0
1737,The Han Dynasty crossbow,43,1520,0,0.94,2023-03-21 07:10:24,Video,Hot,167.0
1738,"Modern Tibetan people are the descendants of people who have continually lived on the Tibetan Plateau for at least 5,000 years",7,261,0,0.95,2023-03-21 14:01:53,Article,Hot,23.0
1739,European Dogs Devastated Indigenous American Pup Populations,1,70,0,0.92,2023-03-21 20:39:59,Article,Hot,2.0
1740,"Saudi Arabia stone ruins were pilgrimage sites, where an ancient cult gathered to sacrifice animals about 7,000 years ago",125,4382,0,0.97,2023-03-20 10:43:44,Article,Hot,961.0
1741,"The Ancient Greeks Had Advanced Plumbing, Drainage, and Water Systems, a cornerstone of a functioning civilization",146,5999,0,0.96,2023-03-19 21:00:35,Article,Hot,524.0
1742,The mystery of Christiaan Huygens’ flawed telescopes may have been solved,3,68,0,0.9,2023-03-20 14:40:46,Article,Hot,7.0
1743,"This explains the history of why Kansas City is famous for having ""the best barbecue in America"" (which of course is up to debate, but the history is interesting)",6,32,0,0.75,2023-03-20 15:07:20,Article,Hot,4.0
1744,"1,800-year-old Roman vase — filled with remains — tells story of gladiators in Britain",4,225,0,0.94,2023-03-19 22:04:42,Article,Hot,19.0
1745,Japanese American Artists Recall the Trauma of Wartime Incarceration,3,28,0,0.86,2023-03-20 02:56:43,Article,Hot,6.0
1746,Adam Shatz · Beyond Borders: Adolfo Kaminsky’s Forgeries · LRB 16 February 2023,5,438,0,0.92,2023-03-19 11:38:16,Article,Hot,11.0
1747,"The Ides of March: an insight into the history, significance and relevance of the infamous day",5,34,0,0.89,2023-03-19 21:59:29,Article,Hot,8.0
1748,Olney: Roman villa mosaic found under Aldi supermarket site,57,4003,0,0.97,2023-03-17 20:47:10,,Hot,452.0
1749,Weekly History Questions Thread.,103,107,0,0.89,2023-03-18 13:00:40,Discussion/Question,Hot,9.0
1750,"Roman tomb reveals burnt remains left in place, covered by bricks, sealed with lime, encircled by bent and broken nails — rites to restrain the dead from rising",47,680,0,0.97,2023-03-17 21:45:19,Article,Hot,74.0
1751,Grad Student Explores Ancient Warfare With Naval Ram Project,67,1681,0,0.95,2023-03-17 04:25:52,Article,Hot,138.0
1752,How many early human species existed on Earth,16,84,0,0.94,2023-03-17 16:43:51,Article,Hot,19.0
1753,She Caught Bullets with Her Bare Hands — and Made Magic’s Glass Ceiling Disappear,0,25,0,0.73,2023-03-17 17:38:01,Article,Hot,
1754,Polish archaeologists excavating at the ruins of old Dongola in Sudan have discovered ancient Egyptian hieroglyphics inscribed on sandstone blocks,79,5626,0,0.97,2023-03-16 01:18:39,Article,Hot,82.0
1755,3D scan of the Tomb of Ramesses II (KV 7) and recent conservation work,17,787,0,0.97,2023-03-16 10:02:04,Article,Hot,41.0
1756,Remains of Roman aristocrat unearthed in ‘extraordinary’ cemetery near Leeds,44,3571,0,0.97,2023-03-15 09:54:03,Article,Hot,1.0
1757,Has the mystery of Leonardo da Vinci's mother finally been solved?,2,44,0,0.91,2023-03-15 16:13:10,Article,Hot,7.0
1758,Bookclub and Sources Wednesday!,13,77,0,0.97,2023-03-15 12:00:57,Discussion/Question,Hot,10.0
1759,The zhamandao: a Chinese greatsword,56,1499,0,0.9,2023-03-14 10:13:36,Video,Hot,247.0
1760,Chinese swords: A dao from the Song Dynasty,3,28,0,0.85,2023-03-15 06:19:13,Video,Hot,3.0
1761,Ancient Chinese longswords of the Han Dynasty era (202 BC-220 AD),1,14,0,0.82,2023-03-15 01:37:17,Video,Hot,2.0
1762,"Minoan sailors may have used star paths and zenith stars to navigate Bronze Age Mediterranean routes, sometime between 3000 BCE to 1100 BCE",119,3905,0,0.97,2023-03-13 03:02:42,Article,Hot,623.0
1763,"Human ancestors were walking upright 7 million years ago, ancient limb bone suggests",54,3420,0,0.96,2023-03-11 19:55:14,Article,Hot,119.0
1764,Weekly History Questions Thread.,186,312,0,0.9,2023-03-11 13:00:29,Discussion/Question,Hot,9.0
1765,The colors on these ancient pots hint at the power of an empire,26,1305,0,0.96,2023-03-10 12:54:50,Science site article,Hot,214.0
1766,"‘Dates add nothing to our culture’: Everywhen explores Indigenous deep history, challenging linear, colonial narratives",31,26,0,0.58,2023-03-10 23:54:40,Article,Hot,1.0
1767,Conway Castle – Mercian Explorer,19,722,0,0.95,2023-03-09 20:53:29,Article,Hot,93.0
1768,Could a Ming dynasty Buddha found near an Australian beach rewrite history?,176,2801,0,0.92,2023-03-09 07:46:54,News article,Hot,1686.0
1769,Unique medieval treasure found with metal detector in The Netherlands,32,458,0,0.96,2023-03-09 13:31:14,Article,Hot,35.0
1770,"Earliest known inscription about Norse god Odin found on a gold disk — in a Danish cache buried about 1,500 years ago",210,7390,0,0.98,2023-03-08 14:23:51,Article,Hot,448.0
1771,"In the summer of 1897, 20 Black U.S. Army infantrymen cycled 1,900 miles on fixed-gear, state-of-the-art bikes from Fort Missoula, Mont., to St. Louis. The Army ordered the grueling expedition to see whether soldiers could form a bicycle corps.",6,86,0,0.88,2023-03-08 18:41:09,Article,Hot,18.0
1772,"Humans Started Riding Horses 5,000 Years Ago, New Evidence Suggests",134,2450,0,0.96,2023-03-07 20:20:15,Article,Hot,323.0
1773,Folktale becomes reality as Roman altar unearthed at Leicester Cathedral | Archaeology,15,334,0,0.96,2023-03-08 06:03:10,Article,Hot,74.0
1774,Bookclub and Sources Wednesday!,23,88,0,0.96,2023-03-08 12:00:40,Discussion/Question,Hot,4.0
1775,Egypt archaeology: Dig unearths smiling mini-sphinx which may represent Claudius,53,2723,0,0.98,2023-03-07 14:32:42,News article,Hot,461.0
1776,What we lost with Persianate modernity | Historical Cultural exchange between Iran and India led to the creation of literary histories that inspired modern nationalism,0,62,0,0.97,2023-03-08 01:15:51,Article,Hot,
1777,"First archaeological correlate of the Egyptian rebellion described on the Rosetta Stone, 196 BCE — Evidence of violent destruction across the ancient city of Thmouis, in Egypt’s Nile delta, ca. 204-186 BCE",8,1203,0,0.98,2023-03-06 23:02:42,Article,Hot,57.0
1778,Ancient DNA unveils disparate fates of Ice Age hunter-gatherers in Europe,17,2636,0,0.95,2023-03-06 13:53:40,Article,Hot,1.0
1779,Medieval babycare: from breastfeeding to developmental toys,17,823,0,0.97,2023-03-06 15:55:58,Article,Hot,68.0
1780,"Peter Skene Ogden, one of the most important and turbulent personalities in the North American Fur Trade.",44,1680,0,0.94,2023-03-05 23:05:54,Article,Hot,176.0
1781,"Researchers in Vietnam Discovered That Two Deer Antlers Languishing in Museum Storage Are Actually 2,000-Year-Old Musical Instruments",43,5986,0,0.97,2023-03-04 21:07:28,Article,Hot,131.0
1782,"Cambridgeshire, U.K. discovery of an ancient comb — carved from human skull — could represent an unusual tradition of local Iron Age communities ca. 2,000 years ago",18,1979,0,0.96,2023-03-04 01:05:39,Article,Hot,111.0
1783,Weekly History Questions Thread.,96,44,0,0.89,2023-03-04 13:00:27,Discussion/Question,Hot,6.0
1784,The amazing life of Julia Rivet.,22,225,0,0.96,2023-03-03 16:26:04,Article,Hot,29.0
1785,"Sea creatures in Greek manuscript and Norse mythology may have been whales with mouths agape — Fish instinctively swim toward apparent shelter of creature’s mouth, a phenomenon depicted in ancient texts as early as 2,000 years ago",50,4699,0,0.97,2023-03-02 19:15:39,Article,Hot,381.0
1786,German’s diary offers rare look of life in Tokyo in mid-19th century,5,314,0,0.97,2023-03-03 04:28:10,Article,Hot,47.0
1787,A Brief History of Pancakes,2,104,0,0.98,2023-03-02 23:21:16,Article,Hot,6.0
1788,"Long-lost ship found in Lake Huron, confirming tragic story",217,4810,0,0.97,2023-03-01 23:20:59,Article,Hot,409.0
1789,Scientists discover corridor in Great Pyramid of Giza,17,100,0,0.97,2023-03-02 11:05:44,Article,Hot,9.0
1790,Medieval babycare: from breastfeeding to developmental toys,11,62,0,0.96,2023-03-02 12:53:58,Article,Hot,9.0
1791,"New analysis of 356 ancient hunter-gatherer genomes — spanning between 35,000 and 5,000 years ago — reveal that homonin of ice-age Europe were not genetically homogeneous",4,219,0,0.95,2023-03-02 00:10:51,Article,Hot,32.0
1792,"Steel was already being used in Europe 2,900 years ago, shows study.",255,5965,0,0.96,2023-03-01 04:53:41,Science site article,Hot,886.0
1793,The difficulties of translating gender in ancient texts,22,28,0,0.66,2023-03-01 23:43:34,Article,Hot,21.0
1794,Bookclub and Sources Wednesday!,29,77,0,0.98,2023-03-01 12:01:07,Discussion/Question,Hot,7.0
1795,"Complete history of evolution of camera, from pinhole to DSLR [with bit of science]",7,38,0,0.95,2023-03-01 07:32:16,Article,Hot,1.0
1796,Revealed: Europe's Oldest Humans had Surprisingly Frequent Intermingling with Neanderthals,119,4414,0,0.95,2023-02-27 18:34:23,Article,Hot,779.0
1797,"Christopher Clark challenges the common view that the revolutions of 1848 were a failure, because 20 years later many of their aims were achieved.",10,155,0,0.92,2023-02-27 22:09:27,Video,Hot,27.0
1798,Alabama artist works to correct historical narrative around beginnings of gynecology – PBS NewsHour,13,52,0,0.63,2023-02-28 03:43:45,Video,Hot,3.0
1799,"4,500-year-old Sumerian temple dedicated to mighty thunder god discovered in Iraq.",145,6172,0,0.97,2023-02-26 15:44:33,Science site article,Hot,1.0
1800,Deadly waves: Researchers document the evolution of plague over hundreds of years in medieval Denmark.,6,1568,0,0.97,2023-02-26 04:26:35,Science site article,Hot,70.0
1801,England's archaeological history gathers dust as museums fill up,4,111,0,0.96,2023-02-26 18:40:01,Article,Hot,38.0
1802,"‘Mermaid mummy’ at Enjuin temple, Japan — a mythical creature supposedly caught in a fishing net circa 1741 — consists of paper, cloth, cotton, animal hair, fish bones, scales and other components",9,505,0,0.93,2023-02-26 10:09:57,Article,Hot,101.0
1803,Treaty of Versailles being ‘too harsh’,82,69,0,0.69,2023-02-26 13:27:53,Article,Hot,155.0
1804,What Was the “Epic Cycle” Really?,1,37,0,0.9,2023-02-26 15:28:53,Article,Hot,4.0
1805,Mysterious marks on Ice Age cave art may have been a form of record keeping.,40,1536,0,0.97,2023-02-25 13:26:36,Article,Hot,31.0
1806,Flotsam found off New York may be from famous SS Savannah,35,2771,0,0.96,2023-02-24 21:52:38,Article,Hot,633.0
1807,Weekly History Questions Thread.,140,71,0,0.88,2023-02-25 13:00:34,Discussion/Question,Hot,6.0
1808,Ern Malley: The influential Australian poet who never existed - BBC News,0,41,0,0.89,2023-02-25 12:58:22,Video,Hot,
1809,Anthropogenic Forests in North America,0,58,0,0.96,2023-02-25 06:30:20,Article,Hot,
1810,"When a builder found a dirty old boot under Hobart barracks, little did he know he'd stumbled upon rare treasure - Major find for early colonial history in Australia.",20,2531,0,0.95,2023-02-24 03:00:32,Article,Hot,103.0
1811,"Homo sapiens may have brought archery to Europe about 54,000 years ago",59,1435,0,0.96,2023-02-23 05:28:48,Article,Hot,216.0
1812,Researchers explore 300-year-old time capsule from pirate ship sunk off Cape Cod,43,1999,0,0.97,2023-02-22 23:40:35,Article,Hot,436.0
1813,"Two previously unknown Roman military camps — uncovered in Bad Ems, Germany — may have been established circa 1st century CE by soldiers in search of silver ore",3,901,0,0.96,2023-02-23 02:17:53,Article,Hot,42.0
1814,The First Fossil Finders in North America Were Enslaved and Indigenous People,81,2116,0,0.81,2023-02-22 21:00:15,Science site article,Hot,531.0
1815,Bookclub and Sources Wednesday!,97,357,0,0.9,2023-02-22 12:00:42,Discussion/Question,Hot,30.0
1816,Historic ‘Blue Plaque’ for MLK unveiled: first in U.S. by British Trust known for recognizing Black history,26,957,0,0.83,2023-02-20 13:39:45,Article,Hot,94.0
1817,"Touch wood: luck, protection, power or pleasure? A wooden phallus from Vindolanda Roman fort",28,1110,0,0.91,2023-02-20 09:57:06,Article,Hot,103.0
1818,"Previously unreleased footage from first submersible dives in July 1986 to the RMS Titanic shipwreck — British passenger liner that sank 14-15 April 1912 remains about 4,000 metres undersea in the Atlantic Ocean",100,2860,0,0.96,2023-02-20 00:21:18,Article,Hot,318.0
1819,'The wound hasn't healed': Activists recount 1898 Wilmington coup that terrorized Black residents,47,882,0,0.81,2023-02-19 14:03:19,Article,Hot,10.0
1820,Inside Abraham Lincoln's Wrestling Career Before He Was President,103,2077,0,0.95,2023-02-19 00:45:36,Article,Hot,469.0
1821,Video talking about the Magellan-Elcano expedition circumnavigating the globe,2,45,0,0.94,2023-02-19 20:55:00,Video,Hot,2.0
1822,Antics and Quackery during Ireland's Easter Rebellion,1,104,0,0.91,2023-02-19 15:01:53,Video,Hot,5.0
1823,"Discovery of 4,500-year-old palace in Iraq may hold key to ancient civilisation | Archaeology",106,5731,0,0.96,2023-02-17 19:17:25,Article,Hot,687.0
1824,Weekly History Questions Thread.,117,139,0,0.88,2023-02-18 13:00:25,Discussion/Question,Hot,9.0
1825,Stunning silver wedding dress recovered from 17th century shipwreck,18,706,0,0.96,2023-02-18 00:38:59,News article,Hot,162.0
1826,"CT scans of a medieval woman’s skull reveal an unprecedented case of cranial surgery using a cruciform incision — on a living subject who survived prior cranial drillings, circa 6th- to 8th-century BCE in central Italy",174,6266,0,0.97,2023-02-16 00:49:23,*CE/AD,Hot,1.0
1827,Why Nikola Tesla is So Famous (and Westinghouse is not),49,183,0,0.86,2023-02-16 14:08:02,Article,Hot,102.0
1828,The American Heiress Who Risked Everything to Resist the Nazis,12,1458,0,0.92,2023-02-15 19:23:33,Article,Hot,116.0
1829,New study examines Leonardo da Vinci's experiments on gravity,75,2176,0,0.96,2023-02-15 09:21:32,Article,Hot,401.0
1830,Did both parties adhere to classical liberalism in the early 1900s? What were the ideological differences between the parties in general and with respect to Progressivism?,10,50,0,0.82,2023-02-15 21:31:22,Discussion/Question,Hot,12.0
1831,How different were the Italians and the Romans in the social war?,7,95,0,0.91,2023-02-15 14:04:27,Discussion/Question,Hot,69.0
1832,Bookclub and Sources Wednesday!,27,95,0,0.94,2023-02-15 12:00:08,Discussion/Question,Hot,9.0
1833,How an All-Black Female WWII Unit Saved Morale on the Battlefield | History,51,1602,0,0.74,2023-02-14 16:45:38,Article,Hot,239.0
1834,The Fascinating World of Aphrodisiacs - 16th century - Just in time for Valentine's Day :),0,75,0,0.83,2023-02-14 14:44:34,Article,Hot,
1835,Beeston Castle - Mercian Explorer,18,953,0,0.94,2023-02-13 21:39:40,Article,Hot,73.0
1836,Proof of mystery settlement of Aboriginal Australians and Indonesians found in an Italian library,85,3555,0,0.97,2023-02-12 15:37:41,Article,Hot,349.0
1837,How a slave stole a Confederate ship and sailed his crew and family to freedom during the Civil War | PBS NewsHour,107,3720,0,0.94,2023-02-12 00:46:09,Video,Hot,93.0
1838,The battle that decided who would dominate Greece: Cynoscephalae 197 BC (4k cinematic),5,84,0,0.92,2023-02-12 13:27:33,Video,Hot,10.0
1839,Trove of spices from around the world found on sunken fifteenth-century Norse ship,201,7154,0,0.97,2023-02-11 00:19:58,Article,Hot,1717.0
1840,George Stinney: The Youngest Person Wrongfully Executed,20,145,0,0.79,2023-02-11 14:04:51,Video,Hot,58.0
1841,Weekly History Questions Thread.,94,34,0,0.87,2023-02-11 13:00:09,Discussion/Question,Hot,4.0
1842,"New evidence indicates that ~2.9 million years ago, early human ancestors used some of the oldest stone tools ever found to butcher hippos and pound plant material, along the shores of Africa’s Lake Victoria in Kenya",213,7017,0,0.97,2023-02-10 01:16:49,Article,Hot,970.0
1843,A review of an ancient Germanic sword,3,82,0,0.93,2023-02-10 06:08:20,Video,Hot,10.0
1844,"Tavern from c. 2700 BCE rediscovered in Iraq with food, bowls, and a contemporary clay-refrigerator inside",164,7507,0,0.97,2023-02-09 06:10:20,Article,Hot,1.0
1845,Roman helmet handle found at Priors Hall Park could show extended military presence,2,156,0,0.96,2023-02-09 22:54:16,Article,Hot,17.0
1846,"In 1942, the U.S. forcibly evacuated 881 Unangax̂ (Aleut / Native Alaskans) from the Island of Atka, near Russia. Many watched as their homes and Churches were burned to keep the Japanese from getting them. In spite this, they remained patriotic and many enlisted in the U.S. Military.",12,95,0,0.91,2023-02-09 23:31:08,Article,Hot,35.0
1847,Skeleton reveals lifestyle of medieval woman - BBC News,18,178,0,0.97,2023-02-09 14:18:33,Trivia,Hot,174.0
1848,"The mysterious doodles hidden in a 1,300-year-old book: Centuries-old books, manuscripts and printing plates often contain invisible etchings, mysterious letters – and even doodles. A new technology that maps the surface of these objects is bringing them to light.",3,33,0,0.88,2023-02-09 13:29:06,Article,Hot,13.0
1849,Portrait of Eroshenko | Kyoto Journal,1,34,0,0.93,2023-02-09 08:41:03,Article,Hot,4.0
1850,"Neanderthals had a taste for a seafood delicacy that's still popular today: ""Neanderthals living 90,000 years ago in a seafront cave, in what's now Portugal, regularly caught crabs, roasted them on coals and ate the cooked flesh, according to a new study.""",343,11233,0,0.95,2023-02-07 22:49:15,Article,Hot,1300.0
1851,Bookclub and Sources Wednesday!,33,50,0,0.88,2023-02-08 12:00:10,Discussion/Question,Hot,14.0
1852,"57 letters written in code by Mary, Queen of Scots — deciphered by a multidisciplinary team of international codebreakers — reveal about 50 new scripts previously unknown to historians",6,267,0,0.97,2023-02-08 01:15:05,Article,Hot,43.0
