Post_Index,Title,Num_Comments,Upvotes,Downvotes,Upvote_Ratio,Date_Posted,Flair,Post_Category,Top_Comment_Score
1,"New ""Discovery Mode"" turns video game ""Assassin's Creed: Origins"" into a fully narrated, interactive guided tour through a detailed recreation of Ptolemaic-period Egypt.",451,53788,0,0.89,2018-02-21 19:36:14,News article,Top,13676.0
2,We are not here to help you with your End of Term papers.,0,38437,0,0.68,2018-06-09 21:33:47,Announcement,Top,
3,"A 1776 excerpt from John Adam's diary where he describes the time he had to share a tiny bed with Benjamin Franklin and, instead of sleeping, they had an argument about whether to keep the windows open or closed. Franklin eventually won the argument when Adams got too tired and fell asleep.",430,36004,0,0.93,2018-04-14 14:23:50,Article,Top,1841.0
4,Famous Viking warrior burial revealed to be that of a woman,324,34926,0,0.85,2017-09-09 15:42:54,News article,Top,4527.0
5,"3,000-year-old underwater castle discovered in Turkey's largest lake",488,34210,0,0.93,2017-11-22 18:19:38,,Top,1747.0
6,"Researchers built a database from 4000 year old clay tablets, plugged it into an economic trade model, and pinpointed 11 potential lost cities",303,34082,0,0.94,2017-11-18 14:39:54,News article,Top,2275.0
7,"My Jewish-American grandfather guarded Nazis in WW2 France. After the war, one his prisoners sent him this illustrated book of his time in the camp.",687,33465,0,0.85,2017-08-18 18:02:56,Image Gallery,Top,6178.0
8,/r/history is closing down for the next 24 hours in response to current events and reddit's response as a platform,0,32898,0,0.7,2020-06-03 12:17:51,,Top,
9,700-year-old Knights Templar cave discovered in England,458,32173,0,0.76,2017-03-08 20:21:34,News article,Top,2298.0
10,"The ""Harlem Hellfighters"" were the first African American regiment in WWI who were assigned to the French forces. None were captured, never lost a trench, or a foot of ground to the enemy. They returned to the U.S. as one of the most successful regiments of World War I",303,31549,0,0.84,2017-03-11 19:01:48,Video,Top,2570.0
11,"In 1830, American consumption of alcohol, per capita, was insane. It peaked at what is roughly 1.7 bottles of standard strength whiskey, per person, per week.",645,31479,0,0.93,2018-08-10 17:36:20,Article,Top,8406.0
12,"40,000-year-old bracelet made by extinct human species found",656,28150,0,0.9,2017-05-15 16:06:48,,Top,3805.0
13,The Last Slave Ship Survivor Gave an Interview in the 1930s. It Just Surfaced,305,27447,0,0.88,2018-05-12 11:42:03,Article,Top,1792.0
14,"The more things change, the more they stay the same: A collection of complaints about the youth throughout history",486,25856,0,0.92,2017-11-09 15:08:05,Trivia,Top,243.0
15,"Today is the 2700th birthday of Rome, here is a 3D reconstruction of the inner city",604,25657,0,0.9,2017-04-21 15:29:57,Video - 2770th birthday,Top,2202.0
16,What women's fashion looked like in every year from 1784 to 1970,682,25603,0,0.89,2017-07-07 15:44:34,Image Gallery,Top,2639.0
17,The rest of the world was horrified by Lincoln's assassination; one British newspaper called it the most momentous murder since Caesar,444,25503,0,0.96,2020-02-13 20:21:29,Article,Top,2991.0
18,"An ancient tablet engraved with 13 verses of the Odyssey has been unearthed in southern Greece in what is possibly the earliest-recorded trace of the epic poem, the culture ministry said Tuesday.",266,25089,0,0.89,2018-07-11 17:51:59,Article,Top,1441.0
19,Archaeologists Find Lost Ancient Greek Temple Of Goddess Artemis,329,25041,0,0.93,2017-09-28 15:15:13,,Top,2613.0
20,"3,800-year-old Egyption Tomb Found, Intact and Untouched",533,24802,0,0.92,2017-03-28 14:33:30,,Top,2273.0
21,World's oldest person Emma Morano dies at 117,523,24766,0,0.9,2017-04-15 18:34:14,News article,Top,6329.0
22,Rare footage of interviews with elderly people in the United States including Civil War veterans and a woman who witnessed the Trail of Tears recorded in 1929.,612,24770,0,0.94,2018-01-28 15:49:52,Video,Top,2104.0
23,Mass grave in England may belong to Viking Great Army: Earlier radiocarbon dating tests were thrown off by fish consumption.,439,24736,0,0.92,2018-02-04 13:09:57,News article,Top,2867.0
24,How the United States Looked Before the EPA,622,24229,0,0.77,2017-06-01 13:00:38,,Top,2287.0
25,"DNA Samples Reveal That Aboriginals Have Been in Australia For About 50,000 Years Already",210,24125,0,0.87,2017-03-17 13:23:24,,Top,3988.0
26,"TIL that Ancient Greek ruins were actually colourful. What's your favourite history fact that didn't necessarily make waves, but changed how we thought a period of time looked?",867,23922,0,0.88,2017-07-04 15:37:11,Discussion/Question,Top,4609.0
27,"With the surprising number of commenters in various subreddits that continue to confidently assert that the Holocaust is a hoax, it’s worth reviewing the prosecution and conviction of Adolf Eichmann.",601,22377,0,0.86,2018-05-02 12:38:16,Discussion/Question,Top,5347.0
28,Oral testimony of an Aboriginal massacre now supported by scientific evidence,250,22176,0,0.89,2017-11-11 14:26:25,,Top,2582.0
29,"112-year-old Francisco Núñez Olivera fought in the Rif War in Morocco in the 1920's, the Spanish Civil War in the 1930's, and is currently the oldest living man in Europe.",401,22149,0,0.9,2017-06-04 15:04:23,,Top,1570.0
30,Plane crash that killed UN boss 'may have been caused by aircraft attack',349,22002,0,0.89,2017-09-26 16:07:58,Article - 1961 accident ,Top,2779.0
31,I’m Dr. Bob Ballard and I’m the oceanographer who found the Titanic shipwreck back in 1985 — AMA!,518,21432,0,0.89,2017-11-21 15:30:31,AMA,Top,1735.0
32,"A century ago, New York City passed the first-ever zoning law, and its innovative 'setback principle' led to the designs of NYC's famous skyscrapers. Once you see it, you can't un-see it.",404,21064,0,0.94,2018-06-14 14:55:00,Video,Top,2210.0
33,"In 1942, a Finnish sound engineer secretly recorded 11 minutes of a conversation between Finland's defense leader, Carl Gustaf Emil Mannerheim, and Adolf Hitler. It is the only known recording of Hitler's normal speaking voice.",649,21063,0,0.95,2017-11-15 03:34:55,Video,Top,2860.0
34,"What are your favorite historical date comparisons (e.g., Virginia was founded in 1607 when Shakespeare was still alive).",921,21059,0,0.89,2017-04-27 13:25:08,Discussion/Question,Top,9881.0
35,r/history will be joining the blackout from June 12-14 to protest the proposed API changes which will end 3rd party apps.,170,20825,0,0.93,2023-06-06 18:34:49,,Top,1063.0
36,Ancient Necropolis in Egypt discovered,502,20375,0,0.93,2018-02-25 17:55:18,Article,Top,2967.0
37,"I’m 39, and went to the museum of tolerance this week, and of everything I learned, the fact that Germany wasn’t in on the holocaust alone blew my mind.",626,20240,0,0.82,2019-01-25 15:16:51,Discussion/Question,Top,6750.0
38,"2,000-year-old marble head of god Dionysus discovered under Rome",371,19974,0,0.96,2019-05-28 14:31:06,News article,Top,2133.0
39,Officials at the Pompeii archaeological site have announced a dramatic new discovery: the skeleton of a man crushed by an enormous stone while trying to flee the explosion of Mount Vesuvius in 79AD.,444,19947,0,0.93,2018-05-29 18:15:42,News article,Top,4075.0
40,"In 1954, Vice President of India presented the US Senate with a gavel which was brought into use after Nixon broke their own 165 year old gavel",371,19830,0,0.88,2017-10-10 17:06:54,,Top,1051.0
41,"In WW II, Germany defeated the British in a football match while both sides were held prisoner by Ireland.",430,19825,0,0.93,2018-04-15 12:11:58,News article,Top,5589.0
42,Archaeologists discover 81 ancient settlements in the Amazon,405,19810,0,0.94,2018-03-27 17:06:23,News article,Top,1923.0
43,"My father, a captured World War II resistance fighter and Auschwitz concentration camp survivor, wrote this unpublished, based-on-true-events book about the Nazis, Hitler, and their occupation of Europe during WWII. (attachment in post)",277,19711,0,0.86,2017-04-13 15:57:47,Discussion/Question,Top,2125.0
44,Viking expert raises doubts over research claiming famous warrior was actually a woman,371,19614,0,0.84,2017-09-15 11:56:32,News article,Top,3322.0
45,"""Civil War lessons often depend on where the classroom is"": A look at how geography influences historical education in the United States.",721,19036,0,0.86,2017-08-24 13:39:28,News article,Top,3044.0
46,[OC] My father (91) talks about a raid by the German Intelligence Service while my grandmother harbored 5 Jewish people in hiding during WW2.,321,18675,0,0.91,2018-07-25 19:25:19,Video,Top,2031.0
47,How did the Red Army react when it discovered concentration camps?,756,17876,0,0.9,2017-01-23 14:08:20,Discussion/Question,Top,21693.0
48,"USS Constitution, ""Old Ironsides"" back in Boston's waters after restoration work",550,17755,0,0.91,2017-07-24 12:29:42,,Top,2335.0
49,Ancient Roman coins found buried under ruins of Japanese castle leave archaeologists baffled,496,17683,0,0.78,2016-09-28 09:46:14,News article,Top,5098.0
50,"Behind Lincoln’s head on Mt. Rushmore is a National Time Capsule intended for future civilizations to discover. The sculptors didn’t want to leave the massive monument without an explanation detailing it’s history, in the way the Egyptian Pyramids are shrouded in mystery.",420,17618,0,0.94,2017-11-27 15:07:06,,Top,4519.0
51,This Map Lets You Plug in Your Address to See How It’s Changed Over the Past 750 Million Years,300,17580,0,0.92,2019-06-13 09:22:18,Article,Top,1762.0
52,"5,300 Years Ago, Ötzi the Iceman Died. Now We Know His Last Meal",621,17408,0,0.93,2018-07-12 18:40:00,Science site article,Top,8819.0
53,Collapse of Aztec society linked to catastrophic salmonella outbreak,412,16944,0,0.91,2017-02-17 18:59:04,Science site article,Top,297.0
54,"Scientists reconstruct the face of a man who died in Cambridgeshire 700 years ago, revealing what an ordinary 13th century man looked like",524,16871,0,0.88,2017-03-22 13:36:19,News article,Top,3673.0
55,"Bones found in 'Massacre Cave', where up to 400 members of Scottish MacDonald clan were wiped out in 16th Century feud with rival MacLeods, prove to be those of a teenager who died between 1430 and 1620",393,16782,0,0.9,2017-11-14 12:05:23,,Top,2060.0
56,Anne Frank's 'dirty jokes' found in hidden diary pages,490,16554,0,0.85,2018-05-17 07:02:17,News article,Top,1917.0
57,"A Lot of What Is Known about Pirates Is Not True, and a Lot of What Is True Is Not Known",474,16404,0,0.86,2017-05-07 14:08:13,,Top,2248.0
58,How a Sneak Attack By Norway’s Skiing Soldiers Deprived the Nazis of the Atomic Bomb,502,16359,0,0.92,2018-02-27 21:16:32,Science site article,Top,2348.0
59,"Rome revokes the exile of the poet Ovid, exactly 2,000 years after his death",285,16341,0,0.94,2017-12-16 17:54:16,News article,Top,1995.0
60,A pretty engaging article about drug use by soldiers throughout history. Drugs have been used in various forms by warriors and soldiers throughout history. Their influence is often overlooked but I found this pretty fascinating!,517,16328,0,0.94,2018-05-23 11:51:31,Article,Top,342.0
61,Here's a photo and translation of a Soviet soldier's last note hidden in an empty rifle cartridge. Found by amateur archeologists with his remains just a couple weeks ago.,669,16074,0,0.91,2016-08-21 04:37:26,,Top,2306.0
62,"Order 9066: An executive order that imprisoned over a 100,000 people of Japanese descent after Pearl Harbour was bombed. This is the first-hand account of those who lived through its enforcement.",329,15931,0,0.89,2018-07-30 14:54:44,Podcast,Top,1692.0
63,"Researchers are still discovering secret passages, new crypts and structures under France's Mont Saint Michel abbey",201,15796,0,0.95,2018-03-19 14:32:52,Article,Top,1122.0
64,"When Air Force One's crew Learned of the Kennedy assassination, They refused to put his body in the cargo hold and modified the plane with a hacksaw to be able to take the coffin in the cabin.",386,15747,0,0.93,2018-10-08 10:42:08,Article,Top,2691.0
65,"Why are the assassinations of Presidents McKinley and Garfield seemingly confined to the back blocks of history, while Presidents Lincoln and Kennedy are theorised, discussed, written about and dramatised in countless documentaries and films on a regular basis?",604,15709,0,0.92,2018-01-10 13:04:59,,Top,7006.0
66,In ww1 when the soldiers on the battlefields had to stop fighting mid-battle because the war ended did they just throw down there weapons? Or did they awkwardly just walk back to their separate camps?,633,15495,0,0.89,2018-11-13 14:15:33,Discussion/Question,Top,11083.0
67,It’s Official: Tut’s Tomb Has No Hidden Chambers After All,288,15440,0,0.94,2018-05-07 06:50:31,Science site article,Top,3028.0
68,"Medieval villagers mutilated the dead to stop them rising, study finds",467,15365,0,0.91,2017-04-03 11:47:03,News article,Top,1805.0
69,Transcripts reveal the reaction of German physicists to the dropping of the atomic bomb on Hiroshima.,766,15234,0,0.93,2016-09-24 21:08:17,PDF,Top,1966.0
70,Medieval Body Mechanics - Man explains and demonstrates how people walked differently in medieval times,602,15131,0,0.91,2017-10-03 01:27:39,,Top,2157.0
71,Archaeologists discover Aztec ball court in heart of Mexico City along with 32 severed vertebrae,401,15080,0,0.94,2017-06-08 12:22:58,News article,Top,1682.0
72,"Recent radar scans of University of Mississippi Medical Center {UMMC) campus grounds reveal that there may be up to 7,000 bodies buried near where a former asylum once stood.",474,15016,0,0.93,2017-05-12 11:47:08,Article,Top,1216.0
73,"Mexico revives 3,000-year-old ancient ball game",436,14819,0,0.91,2017-04-16 12:09:17,News article,Top,2405.0
74,"In honor of the centenary I thought I'd share the WWI journal of my great-grandfather. He was gassed on the last day of the war, blinded for several days and nearly killed. A few years ago I transcribed the journal in its entirety and published it online.",143,14721,0,0.94,2018-11-12 15:04:32,Article,Top,1301.0
75,"The Living Disappeared - During Argentina’s military dictatorship, some 500 babies were born in secret torture centers or kidnapped. A group of grandmothers spent the next four decades searching for them, becoming activists, then icons. But hundreds remained missing. One of them was named Martín.",439,14512,0,0.9,2017-04-26 12:44:26,Article,Top,425.0
76,"First Of Its Kind 4,000-Year-Old Funeral Garden Found in Egypt",328,14391,0,0.92,2017-05-11 12:12:52,,Top,388.0
77,"While decluttering last year, my gram came across 150 year old letters written by a union infantryman. With no significance to her she put them in the mail in the hopes that they would find family. She just came across this article.",437,14391,0,0.89,2016-11-15 15:42:41,Science site article,Top,2974.0
78,Archaeologists Have Discovered More Than 450 Large Geometrical Geoglyphs in the Amazonian Rainforest,363,14280,0,0.92,2017-02-13 13:27:49,,Top,1095.0
79,"Forrest Gump tells the story of a ""slow-witted"" yet simple man, who serendipitously witnesses and directly and positively impacts many historical events, from sports to war to politics to business to disease, etc. Has anybody in history accidentally ""Forrest Gumped"" their way into history?",773,14267,0,0.86,2016-11-16 16:50:49,Discussion/Question,Top,11612.0
80,100 years after the last Faberge egg was made: The heartbreaking story behind some of the most beautiful objects ever made.,430,14197,0,0.91,2017-02-04 15:10:15,News article,Top,1004.0
81,"Archaeologists Unearth Egyptian Queen’s Tomb, 13-Foot ‘Book of the Dead’ Scroll",276,14161,0,0.97,2021-01-22 17:50:54,,Top,1.0
82,Drunk on genocide: how the Nazis celebrated murdering Jews,464,13980,0,0.81,2018-02-17 19:52:17,Article,Top,1648.0
83,Icelanders predated Columbus' arrival to North America by nearly 500 years. New finds in Canada are revealing more sites where Leif Erikson may have settled.,533,13964,0,0.91,2017-01-04 03:49:12,News Article - Misleading title,Top,749.0
84,The Russian President Ended Up Drunk and Disrobed Outside the White House seeking a pizza,392,13826,0,0.89,2018-04-10 10:44:10,Article,Top,3019.0
85,"It's like watching a real-life Scorsese film...NYC Union drivers arguing around a table, 50 years ago. As New York as it gets. Thought r/history might appreciate it.",379,13715,0,0.93,2018-06-24 04:32:42,Video,Top,1273.0
86,Misunderstood Moments in History - Cleopatra's Egypt [Invicta],227,13614,0,0.91,2017-12-22 23:25:05,Video,Top,1797.0
87,How a Mormon lawyer transformed archaeology in Mexico—and ended up losing his faith,434,13524,0,0.87,2018-01-19 15:51:09,Science site article,Top,2135.0
88,What the last Nuremberg prosecutor alive wants the world to know,596,13482,0,0.9,2017-05-10 06:25:01,News article,Top,9623.0
89,Medieval battles weren't as chaotic as people think nor as movies portray!,580,13425,0,0.95,2020-04-16 03:10:26,Discussion/Question,Top,1966.0
90,"This is an excerpt from a 1,900 year old letter I found written by civil officer in Ancient Rome. It's the oldest known reference to a ""haunted house""",440,13350,0,0.95,2018-10-13 05:05:41,Discussion/Question,Top,1639.0
91,We are the same amount of time from WWII as they were from the Civil War as they were from the American Revolution. (About 80 yr each).,311,13325,0,0.93,2019-04-26 01:29:13,Discussion/Question,Top,1565.0
92,Austria to demolish house where Adolf Hitler was born.,625,13325,0,0.85,2016-10-18 21:15:22,News article,Top,599.0
93,"200,000 men from the Qin army were killed at the battle of Julu in China, after the battle, another 200,000 men who surrendered were buried alive.",667,13282,0,0.9,2017-08-09 18:38:54,Discussion/Question,Top,2498.0
94,The vastly wealthy philanthropists who fueled America's pre-industrial knowledge-based economy were opium dealers.,357,13118,0,0.9,2017-07-31 15:46:04,,Top,1387.0
95,Auschwitz inmate forced to help Nazis: Holocaust letters deciphered at last,291,13106,0,0.9,2017-12-04 15:50:22,News article,Top,1130.0
96,100 years ago one of the worlds bloodiest battles began with the whistles calling the men over the top at The Battle of The Somme. It's important we remember the fallen to ensure their deaths aren't in vain.,672,12991,0,0.87,2016-06-30 22:38:14,,Top,491.0
97,"I am a black descendant of President James Madison and the author of a memoir, The Other Madisons: The Lost History of A President’s Black Family. AMA!",306,12950,0,0.85,2020-08-31 18:20:17,AMA,Top,708.0
98,Craziest (unheard of) characters from history,715,12943,0,0.93,2018-12-03 17:58:04,Discussion/Question,Top,1398.0
99,"(as requested) Here is my Grandpa, who turned 97 last month and the last remaining member of The Carpetbagger Project, shares a story of flying over the English Channel on D-Day.",173,12954,0,0.92,2017-05-03 00:53:08,Video,Top,572.0
100,"2 ancient, unlooted tombs unearthed in southern Greece",203,12862,0,0.97,2019-08-12 10:31:48,Article,Top,1765.0
101,The CIA and the Guatemalan genocide: For the uninformed.,636,12864,0,0.87,2017-02-06 16:29:10,,Top,2518.0
102,"The centennial anniversary of World War I is ongoing, and yet I've heard almost nothing about it outside of Reddit. One would think the world would pay more attention to such a massive global event, but it hasn't. Why do you think this is so?",665,12625,0,0.82,2016-10-30 16:40:31,,Top,6073.0
103,"Closing roster of the Japanese internment camp at Rohwer, AR. Among those listed is 7-year-old George Takei.",440,12611,0,0.85,2017-06-16 01:50:18,Image Gallery,Top,2187.0
104,"History isn't a 'useless' major. It teaches critical thinking, something America needs plenty more of",715,12544,0,0.71,2016-05-31 13:15:31,News article,Top,102.0
105,"Exclusive: The skull of a Scandinavian man—who lived a long life 8,000 years ago—from perplexing ritual site has been reconstructed",366,12467,0,0.95,2020-06-23 17:51:09,Science site article,Top,2018.0
106,Stalin's 1938 letter to his son Vasily's teacher.,578,12443,0,0.9,2016-08-23 12:32:22,,Top,6128.0
107,Ancient graffiti in Pompeii is hilarious and fascinating.,724,12422,0,0.9,2016-12-18 02:47:23,,Top,3740.0
108,"The Battle of Waterloo: The Duke of Wellington and the Earl of Uxbridge exhibit stereotypical British toughness and understatement. ""By God sir, I've lost my leg"". ""By God sir, so you have"".",486,12400,0,0.89,2017-04-17 17:00:34,News article,Top,1218.0
109,"The Egyptians may have the most famous mummies, but they're not the oldest. The Chinchorro people of Chile's Atacama Desert were the first to mummify their dead – 7,000 years ago.",203,12275,0,0.97,2022-05-23 18:48:54,Article,Top,1.0
110,"In 1786 while staying in Paris, Thomas Jefferson fell in love with Maria Cosway, a married artist from England. When Maria returned to England, a heartbroken Jefferson sent her this letter which depicts a fictional conversation between his head and his heart.",264,12199,0,0.92,2018-07-24 16:19:55,Article,Top,1796.0
111,Happy 160th birthday to Nikola Tesla!,351,12172,0,0.8,2016-07-10 14:36:05,Image Gallery,Top,143.0
112,"Alexander Carmichael, who spent 50 years collecting legends, songs, curses and oral history from Gaelic-speakers, will soon have his entire work published.",162,12115,0,0.91,2016-06-21 15:31:55,News article,Top,374.0
113,I want to check if you guys are interested in a AMA with my grandmother. She survived the Japanese concentration camps in Indonesia during WWII.,328,12075,0,0.83,2016-04-23 09:36:59,,Top,1157.0
114,Infants from 2100 years ago found with helmets made of children's skulls,378,12045,0,0.97,2019-11-20 10:31:28,Science site article,Top,4390.0
115,Medieval London was the most violent place in England,430,12032,0,0.91,2017-08-28 14:22:23,,Top,1134.0
116,The men who starved to death to save the world's seeds,271,12005,0,0.95,2019-12-01 21:30:01,Article,Top,3797.0
117,"Here's a collection of over 360 historical city maps and illustrations that I've gathered from /r/papertowns, portraying many of the world's cities from the times of antiquity to the 21st century",325,12000,0,0.93,2017-03-25 12:52:41,Image Gallery,Top,438.0
118,Wine Meant to Toast John Adams's Presidency Was Just Discovered (in a museum) | Architectural Digest,371,11989,0,0.92,2017-07-12 10:42:13,,Top,3168.0
119,Why the trial by ordeal was actually an effective test of guilt,497,11952,0,0.85,2017-10-17 14:47:14,Article,Top,2244.0
120,"Unearthing a masterpiece: Archaeologists found this gemstone, just over 1.4 inches long, that was carved with an intricacy never before seen in Aegean Bronze Age artwork—a discovery that could rewrite art history as we know it",273,11946,0,0.93,2017-11-19 15:34:30,,Top,1872.0
121,Ancient Rome in 20 minutes,344,11900,0,0.92,2017-05-31 14:43:29,,Top,321.0
122,"Buried viking ship discovered in Halden, Norway",270,11820,0,0.95,2018-10-15 08:45:11,Article,Top,1078.0
123,"On June 6th, 1944, John Ford commanded a film crew on Omaha Beach. Most of the footage was accidentally dropped overboard.",313,11778,0,0.94,2018-06-07 00:03:55,Discussion/Question,Top,511.0
124,Hitler joined Nazis only after another far-right group shunned him,274,11760,0,0.81,2017-10-30 14:02:23,News article,Top,3902.0
125,"Months after burning down the White House, British Admiral George Cockburn was chosen to personally escort a defeated Napoleon to Saint Helena. Here is his fascinating diary about the voyage.",338,11750,0,0.93,2017-11-04 21:16:26,,Top,1546.0
126,Rare interviews with two men who were witnesses to the 1865 assassination of President Abraham Lincoln recorded in 1929-1930.,319,11699,0,0.96,2018-06-25 22:38:17,Video,Top,1156.0
127,"Interactive 360 of Halifax Explosion. 1917. Largest man made explosion in history prior to nuclear weapons. Also the reason why Halifax sends a Christmas tree to Boston each year as as tradition for their help, 100 years later",324,11700,0,0.94,2017-12-06 14:42:29,News article,Top,862.0
128,WWII Pinup girls,469,11674,0,0.89,2017-04-11 19:39:30,Image Gallery,Top,1508.0
129,The Ancient Greeks had no word to describe the color blue. What are other examples of cultural and linguistic context being shockingly important?,822,11623,0,0.91,2018-03-28 18:29:53,Discussion/Question,Top,398.0
130,"The British Library is making available 40,000 maps dating between 1500 and 1824, which will be freely available online for the first time. They are part of the Topographical Collection of King George III (K. Top), and included maps, atlases, architectural drawings, cartoons and watercolours.",106,11547,0,0.98,2020-11-03 23:38:38,Article,Top,1.0
131,"Student finds 1.8 million-year-old tooth, one of oldest signs of hominins outside of Africa",144,11498,0,0.97,2022-09-10 00:26:02,News article,Top,1017.0
132,"Mystery of 8,000-Year-Old Impaled Human Heads Has Researchers Stumped",368,11476,0,0.93,2018-02-20 15:59:21,Science site article,Top,1314.0
133,Medieval Islamic art and archaeology professor says Viking textile did not feature word 'Allah' and the inscription has 'no Arabic at all',340,11466,0,0.92,2017-10-18 09:43:41,News article,Top,2935.0
134,"During the Civil War, both Abraham Lincoln and Jefferson Davis wrote letters to the Pope trying to get him on their side. Both letters are now stored in the Secret Vatican Archives, deep beneath the surface of Vatican City.",377,11473,0,0.95,2017-12-12 03:07:24,,Top,1969.0
135,Today marks the 100th anniversary of the October Revolution.,433,11446,0,0.87,2017-11-07 15:39:07,,Top,1677.0
136,'Millennia of human activity': heatwave reveals lost UK archaeological sites,214,11446,0,0.94,2018-08-15 21:32:35,News article,Top,828.0
137,'Forgotten archive' of medieval books and manuscripts discovered in Romanian church,211,11444,0,0.98,2022-09-27 19:15:30,Article,Top,251.0
138,Lost WW2 warship USS Indianapolis found after 72 years,323,11380,0,0.93,2017-08-20 14:55:06,News article,Top,1726.0
139,Roman Army Structure visualized,326,11357,0,0.94,2017-03-09 11:42:20,Video,Top,616.0
