Post_Index,Title,Num_Comments,Upvotes,Downvotes,Upvote_Ratio,Date_Posted,Flair,Post_Category,Top_Comment_Score
606,"It's argued that Lincoln had Marfan's Syndrome, what other important people of history had unusual, rare, or otherwise cool disorders/diseases?",792,5061,0,0.89,2017-01-12 16:36:10,,Top,785.0
607,How did pirates dock in ports with out the authorities getting to them ?,246,5037,0,0.95,2019-01-01 08:45:36,Discussion/Question,Top,4500.0
608,Hundreds of mummies and pyramid of an unknown queen unearthed near King Tut's tomb,120,5028,0,0.98,2022-11-16 14:46:54,Article,Top,685.0
609,"Did epic fighters, a single individual who would change the course of a battle, like we see in movies today really exist?",678,5031,0,0.89,2016-11-07 06:05:06,Discussion/Question,Top,3502.0
610,Examples of the ignoble death of Kings?,673,5026,0,0.96,2019-08-28 19:05:40,Discussion/Question,Top,885.0
611,"So, Bjarni Herjólfsson actually ""discovered"" America, but he turned around for a really stupid reason",404,5020,0,0.87,2017-02-10 20:23:10,,Top,1889.0
612,Bruno Lüdke: Germany's worst serial killer during the Weimar Republic and The Third Reich - who actually never killed a single person,320,5029,0,0.88,2016-07-21 10:07:27,Image Gallery,Top,461.0
613,Mysterious crates are found in brazilian beaches. These crates seem to come from a german shipwreck from 1944,168,5017,0,0.98,2021-08-09 02:50:12,Article,Top,508.0
614,How did Roman military generals command so much power?,433,4999,0,0.9,2017-01-09 08:04:21,Discussion/Question,Top,3309.0
615,A firefighter's 1943 photos of the Warsaw Ghetto uprising have been found,152,5003,0,0.97,2023-01-25 00:13:11,Article,Top,972.0
616,Fascism Still Existed in Europe after WWII in Spain up to 1975. Why didn't NATO intervene?,436,4991,0,0.86,2018-10-18 17:01:29,Discussion/Question,Top,6133.0
617,"Archaeologists discovered 7,000-year-old structure in the Czech Republic",102,4984,0,0.97,2022-09-24 06:34:18,Article,Top,137.0
618,Ancient DNA Reveals Complex Story of Human Migration Between Siberia and North America,148,4977,0,0.97,2019-06-06 08:31:46,Science site article,Top,205.0
619,"How many ""schindlers"" were there during the holocaust?",533,4980,0,0.88,2017-05-01 18:13:09,Discussion/Question,Top,2984.0
620,"Explorers find WWII Navy destroyer, deepest wreck discovered",196,4957,0,0.98,2022-06-27 01:39:32,Article,Top,1.0
621,"Last World War II Medal of Honor recipient, West Virginia native Hershel 'Woody' Williams dies at 98",93,4952,0,0.98,2022-06-29 12:39:14,Article,Top,680.0
622,When did Americans begin speaking more casually and using curse words in everyday language?,585,4949,0,0.89,2019-06-21 16:25:54,Discussion/Question,Top,2916.0
623,"The most famous historical figures of the second millennium by decade, according to Wikipedia [international edition]",374,4935,0,0.91,2017-09-12 12:29:40,Image Gallery,Top,565.0
624,"After 350 years, sea gives up lost jewels of Spanish shipwreck - Spanish shipwreck in Bahamas",142,4930,0,0.97,2022-08-01 00:48:01,Article,Top,1.0
625,"I just realized that I have no idea how naval combat occurred before the advent of gunpowder. How did these battles occur, and how did tactics evolve over time (e.g. from ancient Greece, to Rome, to Medieval Europe...)",490,4929,0,0.91,2017-09-18 12:10:10,,Top,2162.0
626,How did courier birds throughout history know where to go to deliver their attached message?,294,4923,0,0.94,2018-12-05 10:35:39,Discussion/Question,Top,4517.0
627,How have combat units in major modern wars not all end up deaf?,436,4923,0,0.92,2017-08-14 13:12:11,Discussion/Question,Top,2931.0
628,New Findings Suggest That Ancient Japan Was More Cosmopolitan Than First Thought,174,4913,0,0.9,2016-10-08 12:12:19,News article,Top,368.0
629,"Humans First Used Tools to Eat Meat 250,000 Years Ago.",275,4924,0,0.89,2016-08-09 12:54:26,News article,Top,329.0
630,Divers find $4.5 million worth of Spanish gold coins in Florida 15 feet from the shore,406,4920,0,0.93,2015-08-24 21:52:48,,Top,470.0
631,"The Principality of Hutt River in Western Australia is a micronation that succeeded from Australia in 1971 in a response to a disputed over wheat quotas and became its own nation. The ruler of the Hutt River, 91-year-old Prince Leonard, announced on Feb 1 that he is abdicating the throne to his son.",413,4913,0,0.88,2017-02-10 05:43:44,Image Gallery,Top,247.0
632,A new genetic study of sweet potatoes shows Pacific Islanders visited The Americas at least 500 years before Columbus,286,4912,0,0.96,2018-02-08 01:53:34,Article,Top,184.0
633,Rome's Mausoleum of Augustus reopens after 100 years of neglect,142,4916,0,0.98,2021-03-03 11:55:27,Article,Top,580.0
634,what was the stupidest war?,719,4903,0,0.89,2016-09-21 14:59:59,Discussion/Question,Top,1672.0
635,"‘Last international brigader’, survivor of Spanish civil war, dies aged 101",221,4905,0,0.97,2021-05-27 15:25:44,Article,Top,732.0
636,We’re the team who restored NASA’s Apollo Mission Control Center to appear as it did originally in 1969. Ask us anything!,293,4898,0,0.96,2019-06-28 16:31:47,AMA,Top,219.0
637,Why there were no shields during the musket period?,582,4896,0,0.91,2017-09-13 11:24:10,,Top,3907.0
638,"Is ""The Epic of Gilgamesh"" the oldest story out there?",407,4899,0,0.93,2018-01-02 02:11:56,,Top,720.0
639,Why did US rebuild Japan after WW2?,546,4901,0,0.87,2017-06-25 11:13:52,,Top,4303.0
640,"Is it true Christmas started off as a Pagan celebration? If yes, how did it become so widely attributed and accepted by Christianity?",420,4891,0,0.85,2016-12-24 14:54:51,,Top,1661.0
641,The road from Rome: the fall of the Roman Empire wasn’t a tragedy for civilisation. It was a lucky break for humanity as a whole. Essay by Professor Walter Scheidel (Stanford University),482,4883,0,0.91,2021-04-19 12:48:45,Article,Top,1.0
642,"[Television] When did the lazy, stupid dad become a stock character for American sitcoms?",638,4886,0,0.91,2017-10-05 15:20:44,Discussion/Question,Top,1616.0
643,"Oldest ever shark attack victim discovered, dating back 3,000 years to Japan's Seto Inland Sea",155,4882,0,0.97,2021-06-29 17:08:17,Article,Top,557.0
644,"Secret pagan basilica in Rome emerges from the shadows after 2,000 years",192,4874,0,0.93,2015-11-20 11:25:11,News article,Top,273.0
645,Antibiotic resistance discovered in the guts of ancient Inca mummies,154,4872,0,0.91,2016-07-09 12:22:29,,Top,260.0
646,The Battle of Midway began 76 years ago today – here is a great video breakdown of the tactics and heroics from the turning point of the Pacific in WWII,283,4864,0,0.95,2018-06-04 12:36:17,Video,Top,223.0
647,Japanese Pilot’s Map of Pearl Harbor Attack Now at Library,182,4856,0,0.97,2020-04-02 17:27:03,Article,Top,432.0
648,Why did Polynesians inhabit isolated islands with no significant resources?,548,4851,0,0.91,2017-05-16 17:35:02,,Top,1518.0
649,I have really low exposure to world history (specifically WW2) and I’m curious.,507,4837,0,0.92,2018-11-06 10:38:05,Discussion/Question,Top,779.0
650,Using AI to uncover ancient mysteries: Modern scientific methods help to decipher 15th century Voynich manuscript,192,4842,0,0.92,2018-01-30 15:21:11,,Top,951.0
651,An Overview of Zoroastrianism,275,4839,0,0.94,2019-07-14 10:34:15,Video,Top,544.0
652,I think I just came across the best explanation of why the study of history is so important I have ever read.,317,4829,0,0.9,2016-08-24 23:33:21,,Top,1075.0
653,A reluctance to kill in battle?,605,4826,0,0.93,2018-07-23 15:31:10,Discussion/Question,Top,4688.0
654,"Historic England asks public to seek ancient scratchings in buildings, called 'Witches Marks' used to ward off evil spirits. The record is thin because they are easy to overlook.",168,4815,0,0.92,2016-10-31 13:09:39,News article,Top,467.0
655,"Long-lost ship found in Lake Huron, confirming tragic story",217,4817,0,0.97,2023-03-01 23:20:59,Article,Top,405.0
656,Was there a contingency plan for the paratroopers that dropped into Normandy before the D-Day invasion?,623,4808,0,0.93,2018-02-13 17:17:11,Discussion/Question,Top,3469.0
657,US Army replaces cake it stole from Italian girl in 1945,97,4810,0,0.92,2022-05-01 05:49:34,Article,Top,1.0
658,Is there any record of what Orville Wright thought about modern aircraft? He died in 1948 and so would have seen the development of aviation become quite advanced.,480,4802,0,0.97,2020-04-28 21:43:28,Discussion/Question,Top,3886.0
659,Prehistoric women’s manual work was tougher than rowing in today’s elite boat crews,364,4795,0,0.86,2017-11-30 11:26:11,,Top,1479.0
660,Handgun accuracy depicted in westerns.,620,4801,0,0.89,2016-12-29 14:55:55,Discussion/Question,Top,8065.0
661,"4,000 year-old shipwreck belonging to Minoans found in Turkey",199,4800,0,0.93,2016-01-31 15:13:19,,Top,396.0
662,Why did the Egyptians lose the ability to read hieroglyphics?,436,4799,0,0.94,2018-10-02 12:08:29,Discussion/Question,Top,3925.0
663,"In 1792, President Washington became so annoyed with the infighting of cabinet members Thomas Jefferson and Alexander Hamilton that he sent a letter to both men demanding that they be kinder to each other. It did not work. Here are the letters and responses from Hamilton and Jefferson.",289,4790,0,0.97,2018-05-20 09:38:06,Discussion/Question,Top,688.0
664,"Had this Japanese flag for 6 years, finally get to send it home.(OC)",470,4791,0,0.89,2016-03-31 19:27:32,,Top,193.0
665,Why did Hitler declare war on the US after Pearl Harbor?,701,4787,0,0.89,2016-10-16 09:50:33,Discussion/Question,Top,4642.0
666,Ancient Egyptian Woman's Face Reconstructed From A Mummified Head,345,4775,0,0.97,2019-03-06 12:18:12,Trivia,Top,490.0
667,"Oldest tartan found to date back to 16th Century - A scrap of fabric found in a Highland peat bog 40 years ago is likely to be the oldest tartan ever discovered in Scotland, new tests have established.",162,4779,0,0.98,2023-03-27 02:39:23,Article,Top,750.0
668,According to a study done by the United States Holocaust Memorial Museum 11 million others were murdered by the Nazis.,442,4767,0,0.89,2020-01-25 20:17:38,Discussion/Question,Top,518.0
669,"No, we aren't going to write your essays for you.",228,4766,0,0.87,2020-03-09 08:31:51,Discussion/Question,Top,614.0
670,Archaeologists uncover a 'Stonehenge' in Brazil's Amazon,246,4769,0,0.94,2016-12-15 03:44:00,News article,Top,663.0
671,"Was the Roman Senate corrupt when Julius Ceasar came to power, or was Julius Ceasar a tyrant?",414,4764,0,0.93,2018-02-06 13:29:22,Discussion/Question,Top,2730.0
672,Why didn't the Vikings transmit diseases to the Native Americans when the settled the area?,352,4761,0,0.9,2017-04-12 17:33:36,,Top,821.0
673,Great Irish Famine Ask Me Anything,530,4757,0,0.9,2018-03-04 12:46:50,AMA,Top,557.0
674,"30,000 Medieval items available online for the first time --- Seven European institutions created a database of 34,000 new images of medieval items, including manuscripts, books, and coins.",31,4748,0,0.98,2022-11-30 01:04:37,Article,Top,205.0
675,Are there any examples of a culture accidentally forgetting major historical events?,569,4753,0,0.95,2021-07-01 19:15:17,Discussion/Question,Top,1.0
676,"Remote cave reveals earliest Australians lived around 50,000 years ago",186,4755,0,0.94,2017-05-21 02:01:50,Article,Top,444.0
677,Why is there so much uniformity across different schools of mythology?,563,4741,0,0.93,2018-06-22 19:10:05,Discussion/Question,Top,3455.0
678,What are the most important battles of history?,488,4727,0,0.91,2017-04-20 20:01:34,,Top,6794.0
679,My Grandfather's memoirs from WW2,167,4733,0,0.93,2018-12-02 20:26:51,Image Gallery,Top,407.0
680,WWII German Pilots vs US Pilots. Why were the kill numbers so drastically different?,642,4729,0,0.93,2019-03-20 15:53:19,Discussion/Question,Top,2473.0
681,Interesting documentary where a team builds a castle using only what they had available in the 13th Century. - Absolute History (Part 1 of 5),103,4719,0,0.97,2020-08-09 13:28:16,Article,Top,290.0
682,What happened to the man that protested in Tiananmen square against the tank?,342,4722,0,0.94,2018-10-16 05:14:11,Discussion/Question,Top,6798.0
683,"My great-great uncle was West Virginia's only flying ace, and has a stained glass window overlooking the Tomb of the Unknown Warrior in Westminster Abbey. It is a fascinating story, I'll include it in the comments below.",150,4716,0,0.93,2018-08-24 20:22:18,Discussion/Question,Top,511.0
684,"Sea creatures in Greek manuscript and Norse mythology may have been whales with mouths agape — Fish instinctively swim toward apparent shelter of creature’s mouth, a phenomenon depicted in ancient texts as early as 2,000 years ago",50,4701,0,0.97,2023-03-02 19:15:39,Article,Top,377.0
685,At what point in human history did eating move from a survival activity to a leisure activity?,407,4689,0,0.86,2016-11-27 17:04:59,,Top,1680.0
686,"Egyptian authorities unveil ancient tomb in Luxor dating back around 3,500 years that archaeologists believe holds the remains of an 18th dynasty royal",110,4694,0,0.97,2023-01-16 07:38:50,Article,Top,638.0
687,What did Germany do after WWII that made it become an economic power?,558,4677,0,0.9,2017-01-18 16:28:27,Discussion/Question,Top,3400.0
688,"‘If you had money, you had slaves’: how Ethiopia is in denial about injustices of the past",367,4680,0,0.93,2023-01-18 18:13:51,Article,Top,1.0
689,"Dig to uncover Sheffield Castle, known for being the site of Mary Queen of Scots' imprisonment, begins",85,4680,0,0.96,2018-08-13 19:53:36,News article,Top,329.0
690,"Ik this may sound like a stupid question, but why does America celebrate the Fourth of July instead of the day they won the revolutionary war?",465,4675,0,0.92,2019-11-14 01:31:44,Discussion/Question,Top,9156.0
691,A Beginner's Guide to Silent Cinema,120,4664,0,0.94,2019-09-09 13:19:50,Video,Top,237.0
692,Why could the mighty Roman Empire not beat the remaining villagers in Northern Scotland?,535,4673,0,0.91,2017-10-09 13:33:05,,Top,4333.0
693,"Woman’s name and tiny sketches found in 1,300-year-old medieval text | Old English name, Eadburg, repeatedly scored into manuscript had remained hidden for more than 12 centuries",84,4668,0,0.97,2022-12-03 00:04:11,Article,Top,1568.0
694,"45 years ago today, Dock Ellis pitched a no-hitter ... while allegedly high on LSD.",413,4669,0,0.87,2015-06-12 14:41:14,,Top,566.0
695,Derbyshire cave house identified as ninth-century home to exiled king,117,4673,0,0.97,2021-07-19 01:42:24,Article,Top,859.0
696,London Rainstorm Reveals Trove of 300 Iron Age Coins,89,4668,0,0.98,2021-07-15 17:15:09,Science site article,Top,435.0
697,"In 1519, Hernan Cortes ordered his troops to burn their ships so there was no going back. What other badass leadership moments occurred in the past?",643,4662,0,0.9,2018-10-20 12:18:27,Discussion/Question,Top,1801.0
698,'Lost' 2nd-century Roman fort discovered in Scotland - Archaeologists have discovered the buried remains of a Roman fort along Scotland's ancient Antonine Wall.,131,4661,0,0.98,2023-04-25 01:19:41,Article,Top,9.0
699,"In the 1600s the size of the Dutch merchant fleet probably exceeded the combined fleets of England, France, Spain, Portugal, and Germany. What made this possible?",252,4651,0,0.94,2017-09-07 09:50:21,,Top,1608.0
700,From 1480 to 1913 European Queens waged far more wars that European Kings,344,4655,0,0.92,2016-01-28 12:40:59,,Top,408.0
701,"On Christmas Day 1859, a single shipment of 24 English rabbits arrived in Australia, triggering a devastating biological invasion with effects still felt today",165,4653,0,0.98,2022-12-28 07:45:26,Article,Top,560.0
702,"I’m Erik Larson, author of six bestselling books, including The Devil in the White City and my newest, The Splendid and the Vile. AMA.",248,4646,0,0.93,2020-03-26 15:58:22,AMA,Top,177.0
703,"Ancient DNA reveals that southwest Asian migrants from Persia intermingled with African people along the Swahili coast, around 1000 CE — findings that align with the oldest Swahili oral stories",168,4640,0,0.97,2023-03-30 09:43:41,Article,Top,242.0
704,"Mayan ball game scoreboard thought to be over 1,000 years old found in Mexico",94,4640,0,0.97,2023-04-12 05:08:40,Article,Top,531.0
705,How did communist countries such as the USSR justify to their people that they couldn't travel to capitalist countries?,615,4639,0,0.92,2019-11-05 11:40:29,Discussion/Question,Top,4705.0
706,My scuba instructor has a small collection of artifacts he retrieved from the Nazi U-85 submarine.,404,4629,0,0.9,2016-12-17 02:08:24,Image Gallery,Top,713.0
707,Why did Europeans travelling to the Americas not contract whatever diseases the natives had developed immunities to?,441,4628,0,0.93,2019-03-10 17:01:22,Discussion/Question,Top,5259.0
708,"I am Mike Duncan, author of THE STORM BEFORE THE STORM and the podcaster behind “The History of Rome” and “Revolutions.” AMA!",398,4622,0,0.9,2017-11-02 14:01:29,,Top,208.0
709,‘The mystery is over’: Researchers say they know what happened to ‘Lost Colony’ of Roanoke Island,385,4625,0,0.96,2020-08-19 20:17:12,Article,Top,1004.0
710,New evidence dates the original construction of Christ's purported tomb around A.D. 345,119,4624,0,0.87,2017-11-28 16:37:43,Science site article,Top,2358.0
711,What America’s immigrants looked like when they arrived on Ellis Island,435,4622,0,0.92,2015-10-26 17:49:58,News article,Top,218.0
712,"No, we really are not going to do your homework.",270,4612,0,0.89,2020-10-30 08:48:48,Discussion/Question,Top,1.0
713,"My Uncle was a Tunnel Rat in Vietnam and has agreed to do an interview with me in the next 2 days, I need help finding the right questions to ask him.",295,4606,0,0.96,2021-12-23 19:35:06,Discussion/Question,Top,555.0
714,Eight-Year-Old Norwegian Girl Discovers Neolithic Dagger at School Playground,47,4605,0,0.97,2023-05-12 10:21:19,Article,Top,1.0
715,18 min Video Documentary: Life in Germany after WWII. Produced by the US government to explain to the American people the situation in Germany and how America was driving reconstruction.,325,4593,0,0.95,2019-09-20 11:04:33,Article,Top,595.0
716,How likely was a survivor or D Day to survive through the rest of the war?,643,4602,0,0.91,2018-02-22 16:49:14,Discussion/Question,Top,4027.0
717,How could returning princes and kings prove their identity in ages without photographs or legal documents?,317,4585,0,0.96,2019-05-05 07:19:51,Discussion/Question,Top,2915.0
718,The warrior queen who 'achieved the incredible',251,4583,0,0.87,2018-06-12 11:49:34,News article,Top,380.0
719,"Australia's deadliest sniper: ""We weren't a lot of Hollywood macho idiots carving notches in our rifle butts. We were never body counters.""",372,4574,0,0.83,2015-01-21 11:18:29,News article,Top,1323.0
720,Amazing archival footage of Market Street in San Francisco less than 4 days before it was all destroyed.,364,4571,0,0.93,2016-09-09 19:44:22,,Top,345.0
721,At which point did European settlers from the British Isles begin speaking with American accents?,690,4571,0,0.86,2016-09-14 12:43:30,Discussion/Question,Top,605.0
722,A Chapter In U.S. History Often Ignored: The Flight Of Runaway Slaves To Mexico,198,4563,0,0.94,2021-03-01 12:06:00,Article,Top,1.0
723,Thor’s hammer amulet discovered in Sweden - Arkeonews,99,4564,0,0.97,2022-10-24 02:11:15,Article,Top,1062.0
724,"Besides the way the Allied Forces treated the Red Baron, are there any other instances throughout history of great respect shown for the enemy?",612,4560,0,0.95,2019-02-24 19:46:18,Discussion/Question,Top,596.0
725,Neanderthal extinction may have been caused by mating with Homo sapiens,31,4562,0,0.95,2022-10-31 22:22:54,Article,Top,1.0
726,Bayeux Tapestry to be displayed in UK,285,4550,0,0.93,2018-01-17 15:02:34,News article,Top,563.0
727,I had an abortion when money made the difference between life and death,36,4549,0,0.72,2017-01-30 13:33:12,News article,Top,296.0
728,"A 103-year-old cracker from the Titanic just sold for $23,000",116,4551,0,0.9,2015-10-27 16:17:22,Locked,Top,743.0
729,Superhighway of ancient human and animal footprints in England provides an 'amazing snapshot of the past',70,4544,0,0.98,2022-10-14 10:12:05,Science site article,Top,111.0
730,At which point in history did castles become obsolete in by means of defence?,421,4540,0,0.92,2017-05-28 10:51:13,,Top,3853.0
731,Mysterious shipwreck identified as Dutch warship that sank after surprise attack in 1672 - identified as the Dutch warship Klein Hollandia,67,4533,0,0.97,2023-01-28 22:29:31,Article,Top,245.0
732,First hand accounts of Kings who knew their heirs would be terrible.,622,4518,0,0.94,2018-07-08 20:57:59,Discussion/Question,Top,2251.0
733,How long did it take to forge weapons back in colonial times? Or even swords in the medieval age?,308,4516,0,0.94,2018-11-25 19:40:36,Discussion/Question,Top,2639.0
734,"CT scans of a fully-wrapped, 2,300-year-old Egyptian mummy reveal the body of a teenage boy — adorned with 49 amulets, garlanded with ferns, and fitted with sandals",96,4514,0,0.97,2023-01-24 09:33:32,Article,Top,283.0
735,"I'm interviewing my grandfather about WW2, he was an American B17 waist gunner that was shot down in 1943 and spent two years in a German POW camp. What questions should I ask?",481,4519,0,0.89,2016-10-23 07:15:19,,Top,2099.0
736,In 1896 an Ethiopian army decisively defeated Italian colonial campaign. This was arguably the first blow against colonialism. Here's a video that shows what happened!,449,4502,0,0.89,2019-03-11 13:19:48,Video,Top,738.0
737,"Possible voice recording of Edison himself: can you hear anything, or clean it up?",343,4506,0,0.94,2017-12-13 15:54:43,,Top,1188.0
738,"The Armenian genocide occured during the time of the Ottoman Empire, so why does Turkey refuse to recognize the event as a genocide?",311,4502,0,0.93,2017-04-19 23:35:36,,Top,1972.0
739,Did the burning of the library of Alexandria really set humanity back?,542,4507,0,0.95,2021-10-04 15:01:19,Discussion/Question,Top,1.0
740,How were horses put down before modern times?,437,4490,0,0.96,2020-02-10 04:37:46,Discussion/Question,Top,189.0
741,Has there ever been a primarily nocturnal civilization?,392,4487,0,0.91,2016-12-03 03:09:56,,Top,4640.0
742,"After WWI, German anger over Versailles was so intense the French built the Maginot Line. Repatriations were the purpose- but why create an untenable situation for Germany that led to WWII? Greed or short-sightedness?",532,4481,0,0.91,2018-11-30 18:06:35,Discussion/Question,Top,3051.0
743,"Which catastrophic events in human history were caused by disorganisation, a lack of communication or incompetence?",174,4481,0,0.91,2017-07-03 15:39:59,,Top,2667.0
744,Virtual autopsy on 150-year-old remains shows how smallpox colonizes the human body,104,4487,0,0.96,2019-10-16 15:11:55,Video,Top,206.0
745,Did medieval royalty prefer to live in castles or was it mostly for defensive purposes?,441,4477,0,0.95,2019-03-26 14:14:39,Discussion/Question,Top,1691.0
746,Interview with Paula Wolff (Hitler's Sister),359,4477,0,0.9,2016-10-13 14:27:06,Article,Top,540.0
747,Is it possible that the assassination of Archduke Franz Ferdinand is the most influential assassination in history?,480,4475,0,0.88,2016-08-16 06:56:07,Discussion/Question,Top,499.0
748,What made Great Britain so powerful?,590,4473,0,0.93,2020-07-18 12:17:48,Discussion/Question,Top,2588.0
749,A memorial website for 1932-1933 Ukrainian famine that's designed as an online restaurant,241,4476,0,0.94,2020-11-27 17:13:25,Article,Top,244.0
750,"The Hind Heist, by Mark Felton Productions",172,4467,0,0.96,2019-11-25 16:37:16,Video,Top,965.0
751,What societies successfully reduced government corruption and how did it happen?,535,4457,0,0.91,2017-04-01 10:04:52,,Top,2239.0
752,What are the greatest infantry battles of ancient history?,593,4453,0,0.93,2018-10-09 14:10:26,Discussion/Question,Top,1276.0
753,2 Men Convicted of Killing Malcolm X Will Be Exonerated After Decades,182,4431,0,0.96,2021-11-17 22:00:38,Article,Top,1138.0
754,"Ann Adamson, who defied Governor to honor slain MLK, dies",57,4432,0,0.88,2016-11-30 17:06:55,,Top,1141.0
755,Is acne a modern thing? Are there any records of people complaining about acne and did ancient humans have them?,495,4430,0,0.95,2020-01-24 13:06:56,Discussion/Question,Top,1778.0
756,"Which historical person, in your own opinion, had the most atypical life, like out of a legend or story?",711,4428,0,0.92,2017-02-03 08:16:38,,Top,637.0
757,"During the American Civil War, was Washington D.C. really the most fortified city on the planet? Did any foreigners make any interesting observations about the defenses?",452,4423,0,0.92,2018-05-19 18:41:22,Discussion/Question,Top,2523.0
758,Revealed: Europe's Oldest Humans had Surprisingly Frequent Intermingling with Neanderthals,119,4416,0,0.95,2023-02-27 18:34:23,Article,Top,782.0
759,How is Napoleon Bonaparte viewed in Europe today?,652,4428,0,0.91,2017-10-22 15:05:06,Discussion/Question,Top,4834.0
760,"New Dan Carlin podcast out - ""The destroyer of worlds."" (x-post /r/Dan_Carlin)",436,4422,0,0.91,2017-01-25 11:42:00,,Top,473.0
761,"First discovery of 50,000-year old human settlements in Australian interior",159,4420,0,0.93,2016-11-02 21:08:29,News article,Top,379.0
762,"Was there ever a time where organized crime groups (Gangs, Mafia, Sydicates etc) primarily helped and protected their communities?",685,4406,0,0.92,2018-04-03 13:49:21,Discussion/Question,Top,1621.0
763,First Female Viking Grave Discovered In Swedish Mountains,191,4400,0,0.93,2022-08-24 15:47:16,Article,Top,1532.0
764,"NASA leaders recently viewed footage of an underwater dive off the East coast of Florida, and they confirm it depicts an artifact from the space shuttle Challenger",86,4399,0,0.97,2022-11-10 22:59:13,Article,Top,458.0
765,The underground remains of the Hippodrome of Constantinople will be unearthed,123,4404,0,0.98,2022-09-26 17:04:12,Article,Top,331.0
